topic,title,pls,article_full_text,fk_score,ari_score,reference,authors_info,journey,abstract,simirality,id,pdf_exist
history-archaeology,Jäger und Sammler bauten älteste Festung der Welt,"Bisher galten steinzeitliche Jäger-und-Sammler-Kulturen als noch zu primitiv, um komplexere Bauten und Siedlungen zu erreichten. Doch jetzt haben Archäologen in Sibirien die älteste befestigte Siedlung der Welt entdeckt – erbaut von Jägern und Sammlern. Schon vor 8000 Jahren errichteten sie eine Festung mit mehreren Gebäuden, die von drei Gräben und einer Holzpalisade geschützt war. Dies wirft ein neues Licht auf die Ursprünge komplexer Gesellschaften – und auf die frühen Kulturen der sibirischen Taiga.
","Bisher galten steinzeitliche Jäger-und-Sammler-Kulturen als noch zu primitiv, um komplexere Bauten und Siedlungen zu erreichten. Doch jetzt haben Archäologen in Sibirien die älteste befestigte Siedlung der Welt entdeckt – erbaut von Jägern und Sammlern. Schon vor 8000 Jahren errichteten sie eine Festung mit mehreren Gebäuden, die von drei Gräben und einer Holzpalisade geschützt war. Dies wirft ein neues Licht auf die Ursprünge komplexer Gesellschaften – und auf die frühen Kulturen der sibirischen Taiga.
Gängiger Annahme nach markierte die neolithische Revolution nicht nur den Beginn der Landwirtschaft und der sesshaften, bäuerlichen Lebensweise. Mit dem Beginn der Jungsteinzeit entwickelten sich die frühen Kulturen sprunghaft weiter. Das Zusammenleben in festen Siedlungen förderte die Entwicklung komplexer Gesellschaften und neuer sozialer, kultureller und technologischer Strukturen: „Traditionell assoziieren archäologische Narrative die Bildung sozial und politisch komplexer Gesellschaften erst mit dem Aufkommen der Landwirtschaft“, erklären Henny Piezonka von der Freien Universität Berlin und ihre Kollegen. Auch komplexere architektonische Strukturen wie größere Siedlungen und Festungen wurden meist erst ab der Jungsteinzeit nachgewiesen.
Doch jetzt zeichnen Ausgrabungen in der sibirischen Taiga ein ganz anderes Bild. Piezonka und ihre Kollegen haben dort, zwischen dem Ural und dem Fluss Jenissei, gleich mehrere von steinzeitlichen Jägern und Sammlern erbaute Siedlungen entdeckt. „Allein acht verschiedene Steinzeit-Siedlungen dieser Art sind bisher bekannt“, berichten die Forschenden. Eine dieser befestigten Siedlungen ist Amnaya I, eine Steinzeit-Festung, die auf einem Sandstein-Vorsprung über einer sumpfigen Flussebene lag. Die Ausgrabungen enthüllten dort neben den Fundamenten von zehn größeren Gebäuden auch Reste einer Holzpalisade und mindestens drei Wallgräben. Die Bauweise der Häuser spreche dafür, dass es sich hier um länger genutzte Behausungen handelte. Davon zeugen auch Relikte von mindestens 45 Tongefäßen, die in Amnaya I gefunden wurden.
Das Überraschende jedoch: Radiokarbon-Datierungen zufolge sind die Bauten von Amnaya I schon rund 8000 Jahre alt. „Dies weist sie als das älteste bekannte Fort der Welt aus“, sagt Piezonka. Als erstes wurden in Amnaya I die Holzpalisade und einer der Gräben gebaut, später kamen dann die größeren Gebäude im Innenraum, weitere Gräben und eine zweite Palisade dazu. Rund 50 Meter von Amnaya I entfernt entdeckten die Archäologen noch eine zweite, nicht befestigte Siedlung. Diese Amnaya II getaufte Anlage umfasst ebenfalls rund zehn Häuser und stammt etwa aus der gleichen Zeit wie die vorgelagerte Festung. „Die Datierungen sprechen dafür, dass dieser Komplex in eine befestigte ‚Zitadelle‘ und einen vorgelagerten ‚Burghof‘ gegliedert war“, berichten die Archäologen.
Aufgrund ihres Alters können diese sibirischen Steinzeit-Siedlungen nur von den damals in dieser Region lebenden Jägern und Sammler errichtet worden sein, wie das Team erklärt. „Der Amnaya-Siedlungskomplex kennzeichnet den Anfang eines einzigartigen, langanhaltenden Phänomens von Jäger-und-Sammler-Verteidigungsstrukturen im Norden Eurasiens“, so die Archäologen. „Diese Erkenntnis verändert unser Verständnis der frühen menschlichen Gesellschaften.“ Denn Amnaya I und die anderen Siedlungen demonstrieren, dass die Jäger und Sammler in der sibirischen Taiga schon vor 8000 Jahren komplexe Verteidigungsanlagen errichteten – lange bevor solche Bauten in Europa oder anderswo entstanden.
Warum ausgerechnet die Jäger und Sammler der Taiga vor rund 8000 Jahren diese Siedlungen bauten, ist noch unklar. Weitere Funde legen aber nahe, dass es in diesem Teil Sibiriens damals einen generellen Schub der kulturellen und sozialen Entwicklung gegeben haben muss. „Dieses steinzeitliche Innovations-Paket umfasste technologische Neuerungen beispielsweise bei den Töpferwaren, außerdem rituelle Praktiken, die Ressourcennutzung und die sozio-politische Organisation“, berichten Piezonka und ihre Kollegen. Wodurch dieser Entwicklungsschub ausgelöst wurde, ist jedoch nicht geklärt.
Ein möglicher Auslöser könnte ein Klimawechsel vor rund 8200 Jahren gewesen sein, durch den sich die Verfügbarkeit von Ressourcen in dieser Gegend veränderte. Eine erhöhte Konkurrenz um Fischgründe, Wild und andere Nahrungsquellen oder aber der Zuzug von Menschen aus anderen Gebieten könnte dann die Gesellschaften verändert haben. „Die befestigten Siedlungen mit Blick auf die Flüsse dienten möglicherweise als strategische Standorte zur Kontrolle und Ausbeutung der ergiebigen Fischgründe“, erklärt Piezonka. „Der Wettbewerbscharakter, der sich aus der Lagerung von Ressourcen und der Zunahme der Bevölkerung ergibt, ist in diesen prähistorischen Bauten offensichtlich und widerlegt frühere Annahmen, dass es in Jäger- und Sammlergesellschaften keine größeren Konflikte gab.“",None,None,10.15184/aqy.2023.164,"['Henny Piezonka: ', 'Natalya Chairkina: ', 'Ekaterina Dubovtseva: ', 'Lyubov Kosinskaya: ', 'John Meadows: ', 'Tanja Schreiber: ']",Antiquity,"Archaeological narratives have traditionally associated the rise of social and political ‘complexity’ with the emergence of agricultural societies. However, this framework neglects the innovations of the hunter-gatherer populations occupying the Siberian taiga 8000 years ago, including the construction of some of the oldest-known fortified sites in the world. Here, the authors present results from the fortified site of Amnya in western Siberia, reporting new radiocarbon dates as the basis for a re-evaluation of the chronology and settlement organisation. Assessed within the context of the changing social and environmental landscape of the taiga, Amnya and similar fortified sites can be understood as one facet of a broader adaptive strategy.",0.6470942,12,0
history-archaeology,Biber-Jagd vor 400.000 Jahren,"Von wegen nur auf die Großwildjagd spezialisiert: Eine Studie belegt, dass die frühen menschlichen Bewohner des heutigen Deutschlands ein breiteres Beutespektrum nutzten: Sie machten offenbar auch systematisch Jagd auf Biber. Dies geht aus der Untersuchung einer großen Knochenansammlung der Nager hervor, die in Thüringen entdeckt wurde. Charakteristische Schnittspuren an den etwa 400.000 Jahre alten Überresten belegen, dass die Tiere von menschlichen Wesen geschlachtet und gehäutet wurden. Den Befunden zufolge hatten es die eiszeitlichen Jäger offenbar gezielt auf junge Exemplare abgesehen, die fett und ausgewachsen, aber noch unerfahren waren, berichten die Forscher.","Von wegen nur auf die Großwildjagd spezialisiert: Eine Studie belegt, dass die frühen menschlichen Bewohner des heutigen Deutschlands ein breiteres Beutespektrum nutzten: Sie machten offenbar auch systematisch Jagd auf Biber. Dies geht aus der Untersuchung einer großen Knochenansammlung der Nager hervor, die in Thüringen entdeckt wurde. Charakteristische Schnittspuren an den etwa 400.000 Jahre alten Überresten belegen, dass die Tiere von menschlichen Wesen geschlachtet und gehäutet wurden. Den Befunden zufolge hatten es die eiszeitlichen Jäger offenbar gezielt auf junge Exemplare abgesehen, die fett und ausgewachsen, aber noch unerfahren waren, berichten die Forscher.

Von was ernährten sich die archaischen Menschenformen, die im Verlauf der letzten Eiszeit in Europa gelebt haben? „Bisher prägte die Lehrmeinung, dass sie sich bis vor zirka 50.000 Jahren vor allem von Großwild ernährten und dass dies einen wichtigen Unterschied zu den flexiblen Nahrungsstrategien des modernen Menschen dargestellt haben könnte“, sagt Erst-Autorin Sabine Gaudzinski-Windheuser von der Johannes Gutenberg-Universität Mainz. Zumindest was die Neandertaler betrifft, gibt es mittlerweile aber bereits Hinweise darauf, dass auch sie schon ein breiteres Nahrungsspektrum besaßen, als lange angenommen. Inwieweit allerdings auch schon ihre Vorfahren aus dem mittleren Pleistozän neben Großwild kleinere Tiere als Ressource nutzten, ist unklar. Denn anhand von Schnittspuren an Knochen ist nur die Nutzung von Großsäugern wie Wildrindern und Nashörnern durch die Homininen dieser Ära belegt.
Doch es liegt nahe, dass dies einen schiefen Eindruck zur Ernährungsweise vermittelt. Gaudzinski-Windheuser zufolge hat dies einen simplen Grund: „Die Überreste von großen Tieren aus dieser Zeit sind im Allgemeinen viel besser erhalten als die von kleinen Tieren“. Im aktuellen Fall geht es nun aber doch um Funde der zweiten Kategorie aus der Ära des Mittleren Pleistozäns. Es handelt sich dabei um eine Sammlung von Biberknochen, die im Verlauf der letzten Jahre an einem Fundort bei Bilzingsleben in Thüringen ausgegraben wurden. Insgesamt sind es 2496 Knochen und Zähne, die wahrscheinlich von insgesamt 94 Bibern stammen. Der Datierung zufolge haben sie vor etwa 400.000 Jahren in dem damals von Gewässern geprägten Gebiet gelebt.
Mit Blick auf die überraschend umfangreiche Ansammlung von Biberüberresten stellten sich die Wissenschaftler die Frage, ob die Tiere auf natürliche Weise umgekommen waren. Ein merkwürdiger Aspekt war dabei auch, dass es sich den Merkmalen der Knochen und Zähne zufolge mehrheitlich um recht junge Tiere gehandelt hat. Hatten also vielleicht menschliche Wesen die Hand im Spiel gehabt? Um Genaueres zu erfahren, haben Gaudzinski-Windheuser und ihre Kollegen die Knochen nun mit verschiedenen Vergrößerungstechniken unter die Lupe genommen, um möglicherweise subtile Bearbeitungsspuren aufzudecken.
Wie sie berichten, identifizierten sie tatsächlich zahlreiche Schnittspuren von Steinwerkzeugen an den Knochen. Es liegt nahe, dass sie der Entfernung von Fleisch gedient haben. In einige Fällen zeichnet sich aber auch anhand der Positionen der Schnittspuren ab, dass sie der Entfernung des Fells des Tieres gedient haben könnten. Insgesamt lassen die identifizierten Spuren darauf schließen, dass die Tierkörper intensiv genutzt wurden, so die Forscher. „Interessant ist auch, dass es sich bei den Überresten in Bilzingsleben vor allem um Knochen junger, erwachsener Biber handelt“, sagt Gaudzinski-Windheuser. Wie sie erklärt, legt dies nahe, dass die Menschen damals gezielt Jagd auf diese zwar ausgewachsenen, aber noch unerfahrenen Tiere gemacht haben. Vielleicht waren sie durch bestimmte Jagdstrategien leichter zu erbeuten, so die mögliche Erklärung.
Grundsätzlich klar erscheint, dass sich die Jagd auf die bis zu rund 20 Kilogramm schweren Nager gelohnt haben könnte. Denn der Körper des Bibers besitzt viel energiereiches Fett, dass die Menschen des mittleren Pleistozäns sicher gut gebrauchen konnten. Außerdem könnte sein dichtes und wärmendes Fell begehrt gewesen sein. Sogar einen möglichen dritten Aspekt gibt es: Die Nager produzieren ein Sekret, das als Bibergeil bezeichnet wird. Es wird seit Urzeiten zu medizinischen Zwecken genutzt und kann auch bei der Jagd auf verschiedene Tiere als ein Lockmittel eingesetzt werden.
Wie genau die menschlichen Wesen den Biber vor 400.000 Jahren nutzten, bleibt zwar unklar, doch grundsätzlich haben die Studienergebnisse nun verdeutlicht: „Auch schon bei den archaischen Menschen im Europa des mittleren Pleistozäns gab es eine größere Diversität bei der Beutewahl als allgemein angenommen“, resümieren die Wissenschaftler.",None,None,10.1038/s41598-023-46956-6,"['Sabine Gaudzinski-Windheuser: ', 'Lutz Kindler: ', 'Wil Roebroeks: ']",Scientific Reports,"Data regarding the subsistence base of early hominins are heavily biased in favor of the animal component of their diets, in particular the remains of large mammals, which are generally much better preserved at archaeological sites than the bones of smaller animals, let alone the remains of plant food. Exploitation of smaller game is very rarely documented before the latest phases of the Pleistocene, which is often taken to imply narrow diets of archaic Homo and interpreted as a striking economic difference between Late Pleistocene and earlier hominins. We present new data that contradict this view of Middle Pleistocene Lower Palaeolithic hominins: cut mark evidence demonstrating systematic exploitation of beavers, identified in the large faunal assemblage from the c. 400,000 years old hominin site Bilzingsleben, in central Germany. In combination with a prime-age dominated mortality profile, this cut mark record shows that the rich beaver assemblage resulted from repetitive human hunting activities, with a focus on young adult individuals. The Bilzingsleben beaver exploitation evidence demonstrates a greater diversity of prey choice by Middle Pleistocene hominins than commonly acknowledged, and a much deeper history of broad-spectrum subsistence than commonly assumed, already visible in prey choices 400,000 years ago.",0.6955466,13,0
history-archaeology,Feldpost aus dem Siebenjährigen Krieg,"Nachdem sie 256 Jahre in einem britischen Archiv lagerten, hat ein Historiker jetzt erstmals Briefe geöffnet und gelesen, die im Jahr 1758 an französische Seeleute geschrieben wurden. Die Briefe stammen von den Frauen, Eltern oder Geschwistern der im Siebenjährigen Krieg von den Briten gefangen genommenen Seeleute, die diese Botschaften nie erhielten. Die Briefe wurden stattdessen von der britischen Marine beschlagnahmt und landeten ungeöffnet im Archiv. Ihr Inhalt gibt nun einen einzigartigen Einblick in Beziehungen und Alltag in den damaligen Kriegszeiten.
","Nachdem sie 256 Jahre in einem britischen Archiv lagerten, hat ein Historiker jetzt erstmals Briefe geöffnet und gelesen, die im Jahr 1758 an französische Seeleute geschrieben wurden. Die Briefe stammen von den Frauen, Eltern oder Geschwistern der im Siebenjährigen Krieg von den Briten gefangen genommenen Seeleute, die diese Botschaften nie erhielten. Die Briefe wurden stattdessen von der britischen Marine beschlagnahmt und landeten ungeöffnet im Archiv. Ihr Inhalt gibt nun einen einzigartigen Einblick in Beziehungen und Alltag in den damaligen Kriegszeiten.
Während des Siebenjährigen Krieges von 1756 bis 1763 kämpften die Großmächte des damaligen Europas um die Vorherrschaft auf dem Kontinent und in den Kolonien. Es ging um die politische Macht, um Handelsvorteile und die Herrschaft über die wichtigen Seerouten nach Übersee. Dabei standen Preußen und Großbritannien auf der einen Seite einer Allianz von Frankreich, Spanien und der österreichischen Habsburgermonarchie gegenüber. Neben Landgefechten in Europa, der Neuen Welt und Südasien trugen die Kriegsparteien ihre Kämpfe auch zur See aus.
Im Ärmelkanal und entlang der Atlantikküste lieferten sich dabei vor allem Frankreich und Großbritannien Seegefechte. Die französische Flotte verfügte zur damaligen Zeit über einige der besten Kriegsschiffe Europas, es fehlte ihr aber an erfahrenen Seeleuten. Dies nutzte Großbritannien aus, indem es gezielt so viele französische Schiffe kaperte und die Schiffsbesatzungen gefangen nahm wie es konnte. Allein im Jahr 1758 saßen dadurch rund ein Drittel der französischen Seeleute in britischer Gefangenschaft, während der sieben Jahre des Krieges belief sich die Gesamtzahl der Gefangenen auf gut 64.000 Matrosen und Offiziere.
Für die Angehörigen dieser Kriegsgefangenen bedeutet dies meist Ungewissheit und Kontaktverlust: Schon zu normalen Zeiten war es schwierig, Seeleute per Brief zu erreichen. Meist wurden Briefe auf Verdacht an verschiedene Häfen geschickt oder man gab sie Schiffskameraden des auf See dienenden Sohnes, Bruders oder Ehemannes mit. Wurden Schiffe gekapert und Seeleute gefangengenommen, wurden diese Briefe oft zusammen mit anderen persönlichen Habseligkeiten beschlagnahmt. Im Fall von gekaperten Schiffen wurden die Briefe von den französischen Häfen häufig nach England weitergeleitet, in der Hoffnung, dass sie so die Gefangenen erreichen würden.
Dies war auch bei 102 Briefen der Fall, die von Angehörigen an die Seeleute an Bord des französischen Schiffs Galatée geschickt worden waren. Nachdem das Schiff im Jahr 1758 auf dem Weg von Bordeaux ins kanadische Quebec von der britischen Marine abgefangen und nach England gebracht worden war, wurden die Briefe nach England weitergeleitet. Doch die Beamten der britischen Admiralität beschlagnahmten die Briefe und lagerten sie ungeöffnet ein. Erst jetzt – 256 Jahre später – hat Renaud Morieux von der University of Cambridge diese historischen Briefe wiederentdeckt und erstmals aufgemacht und gelesen.
„Ich habe diese Schachtel eigentlich nur aus Neugierde aus dem Archiv bestellt“, berichtet Morieux. „In ihr lagen drei Stapel von Briefen, die mit Bändchen zusammengeschnürt waren.“ Siegel zeigten, dass diese Briefstapel seit ihrer Archivierung während des Siebenjährigen Krieges offenbar nie mehr näher untersucht worden waren. „Da wurde mir klar, dass ich die erste Person war, die diese sehr persönlichen Botschaften seit ihrer Niederschrift lesen würde“, sagt der Historiker. „Denn die Adressaten hatten damals keine Chance dazu.“ Beim Öffnen zeigte sich, diese Briefe oft von den Ehefrauen und Verlobten der Seeleute stammten, aber auch von Eltern oder Geschwistern.
Die Inhalte der Briefe geben bewegende und oft sehr emotionale Einblicke in das Leben und die Familienbande der Seeleute. „Diese Briefe spiegeln universelle menschliche Erfahrungen wider – sie sind keineswegs nur typisch für das Frankreich des 18. Jahrhunderts“, betont Morieux. Stattdessen erscheinen einige Liebesbriefe erstaunlich modern und gewagt für die damalige Zeit: „Ich kann gar nicht erwarten, dich zu besitzen“, schreibt beispielweise Anne Le Cerf an ihren Mann, einen Offizier auf der Galatée. Anne Le Cerf sah ihren Mann allerdings nie wieder, sie starb, noch bevor er aus der Gefangenschaft entlassen wurde, wie der Historiker ermittelt hat. In einem anderen Brief schreibt die Frau eines Leutnants auf der Galatée: „Ich könnte die ganze Nacht hier sitzen und Dir schreiben … Ich bleibe für immer deine treue Frau. Gute Nacht, mein lieber Freund.“ Auch der Mann von Marie Dubosc erhielt ihren Liebesbrief nie.
„Wenn wir von unseren Liebsten durch Ereignisse wie Kriege oder Pandemien getrennt werden, suchen wir nach Wegen, um in Verbindung zu bleiben, wir sorgen uns um diese Menschen und versuchen, die Leidenschaft wachzuhalten“, sagt Morieux. „Heute haben wir Zoom und WhatsApp – im 18. Jahrhundert hatten die Menschen nur Briefe, aber was sie schrieben, fühlt sich sehr vertraut an.“ Andere Briefe geben tiefe Einblicke in das Alltagsleben der zurückgebliebenen Frauen und Familien. „Diese Briefe widerlegen die altmodische Annahme, dass Krieg Männersache ist“, erklärt Morieux. Denn wie in vielen anderen Kriegen übernahmen damals die Frauen viele klassische Männeraufgaben – von der Leitung eines Hofes oder Betriebs bis zum Wirtschaften im Haushalt. „Siefällten dabei wichtige wirtschaftliche und politische Entscheidungen.“",None,None,10.1017/ahss.2023.75,['Renaud Morieux: '],"Annales. Histoire, Sciences Sociales","Cet article porte sur une source exceptionnelle – près de 80 lettres jamais lues, comme en attestent les enveloppes toujours scellées, envoyées à l’équipage d’un seul bateau français capturé pendant la guerre de Sept Ans (1756-1763). Les lettres aux marins, qui aident à entretenir des relations mises en danger par la distance et l’incertitude du retour, offrent des clefs d’analyse pour comprendre la résilience des liens familiaux en temps de guerre. Contre une approche qui verrait dans ces documents une trace de l’émergence de la famille nucléaire ou de l’intimité moderne, c’est bien comme vecteur d’une histoire sociale qu’ils sont ici saisis. Ces correspondances jouent un rôle essentiel dans la circulation de l’information et la survie de l’unité familiale. Il ne s’agit pas d’envisager celles-ci en tant que marqueur d’échanges personnels, privés et intimes. Au contraire, ces lettres doivent être appréhendées comme le tissu de relations sociales multiples et complexes, à la fois familiales et de voisinage. Leur écriture comme leur lecture engagent de multiples individus, bien au-delà des simples signataire et destinataire. Il s’agit, fondamentalement, de traquer les dynamiques sociales, dans leur matérialité même, qui formalisent l’expression des émotions.",0.72199637,14,0
