topic,title,pls,article_full_text,fk_score,ari_score,reference,authors_info,journey,abstract,simirality,id,pdf_exist
history-archaeology,Älteste Oldowan-Steinwerkzeuge entdeckt,"Als unsere Vorfahren begannen, Steinwerkzeuge zu nutzen, brachte dies ihre kulturelle und geistige Entwicklung einen entscheidenden Schritt voran. Als besonders wichtig gilt dabei die Erfindung der Oldowan-Werkzeugtechnik. Jetzt haben Forscher im Westen Kenias die bisher ältesten Zeugnisse dieser Oldowan-Kultur entdeckt: Rund 2,9 Millionen Jahre alte Steinwerkzeuge mit Gebrauchsspuren, die ihren Einsatz zum Zerlegen von Großwild und die Zubereitung von Pflanzen verraten. Zwei an derselben Fundstelle entdeckte Zähne eines Paranthropus-Vormenschen werfen zudem die Frage auf, ob diese Werkzeugtechnik möglicherweise doch nicht erst von Frühmenschen der Gattung Homo, sondern schon von ihren Vorgängern entwickelt worden ist.
","Als unsere Vorfahren begannen, Steinwerkzeuge zu nutzen, brachte dies ihre kulturelle und geistige Entwicklung einen entscheidenden Schritt voran. Als besonders wichtig gilt dabei die Erfindung der Oldowan-Werkzeugtechnik. Jetzt haben Forscher im Westen Kenias die bisher ältesten Zeugnisse dieser Oldowan-Kultur entdeckt: Rund 2,9 Millionen Jahre alte Steinwerkzeuge mit Gebrauchsspuren, die ihren Einsatz zum Zerlegen von Großwild und die Zubereitung von Pflanzen verraten. Zwei an derselben Fundstelle entdeckte Zähne eines Paranthropus-Vormenschen werfen zudem die Frage auf, ob diese Werkzeugtechnik möglicherweise doch nicht erst von Frühmenschen der Gattung Homo, sondern schon von ihren Vorgängern entwickelt worden ist.
Schon vor 3,3 Millionen Jahren schlugen Vormenschen Steine zu einfachen Steinwerkzeugen zurecht, wie Funde am Turkanasee in Kenia belegen. Diese ersten Werkzeuge waren jedoch noch unhandlich und grob. Sie entstanden, indem ein Steinbrocken so lange auf eine Felsunterlage geschlagen wurde, bis er einige scharfe Kanten aufwies. Demgegenüber stellte die Oldowan-Technik einen echten Entwicklungssprung dar. Sie umfasste drei verschiedene Werkzeugtypen, die durch Aneinanderschlagen von zwei in der Hand gehaltenen Steinen gefertigt wurden. Ein Hammerstein diente dabei als Schlagwerkzeug, mit dem von dem zweiten Stein gezielt und systematisch feine Abschläge abgetrennt wurden. Die Abschläge dienten dann als Klingen und Messer, während der ovale, ebenfalls scharfkantige Reststein als Schaber oder Axt verwendet werden konnte.
„Die Oldowan-Technologie eröffnete unseren Vorfahren plötzlich neue Möglichkeiten, sich Nahrung zu verschaffen“, erklärt Seniorautor Richard Potts vom National Museum of Natural History in Washington DC. Doch wann unsere Vorfahren diesen Meilenstein der Werkzeugentwicklung erstmals erreichten und welche Vor- oder Frühmenschenart die Oldowan-Werkzeuge erfand, ist unklar. Die bisher ältesten Oldowan-Steinwerkzeuge wurden im Jahr 2019 in der Nähe von Ledi-Geraru in der Afar-Region Äthiopiens entdeckt. Sie sind rund 2,6 Millionen Jahre alt und stammen aus der Nähe einer Fundstätte von frühen Vertretern der Gattung Homo. Ob diese Frühmenschen jedoch die Erschaffer dieser Werkzeuge waren und wie sie sie einsetzten, ließ sich aus den Funden in Äthiopien nicht eindeutig entnehmen. Klar ist nur, dass sich die Oldowan-Technologie relativ schnell über Afrika und später sogar bis nach Asien ausbreitete. Erst vor rund 1,7 Millionen Jahren wurde sie allmählich durch die noch ausgereifteren Faustkeile der Acheuleen-Technologie abgelöst.
Neue Einblicke in die Oldowan-Technologie und ihre Ursprünge liefern nun Funde, die das Team um Potts und Erstautor Thomas Plummer vom Queens College in New York am Südufer des Viktoriasees in Kenia gemacht haben. Bei den seit 2015 laufenden Ausgrabungen in Nyayanga auf der Homa-Halbinsel haben die Wissenschaftler mehr als 330 Steinwerkzeuge aus Quarz, Quarzit, Granit und anderen Gesteinen entdeckt, darunter alle drei für die Oldowan-Kultur typischen Werkzeugformen. „Die technologischen Merkmale dieser Werkzeuge, wie die Größen der Abschläge und Kerne und die Anzahl der Abschlagsspuren auf den Steinkernen ähneln denen anderer Oldowan-Funde“, berichten Plummer und seine Kollegen. Datierungen mithilfe verschiedener unterschiedlicher Methoden ergaben, dass diese Steinwerkzeuge zwischen 2,58 und 3 Millionen Jahre alt sind, wahrscheinlich ist ein Alter von rund 2,9 Millionen Jahren. „Damit ist dies eines der ältesten, wenn nicht sogar das älteste Zeugnis der Oldowan-Technologie“, sagt Plummer.
Nähere Analysen ergaben, dass viele der in Nyayanga gefundenen Werkzeuge Gebrauchsspuren aufweisen. Gruben und Schrammen auf den Hammersteinen sowie winzige Pflanzenreste in den Unebenheiten deuten auf eine Nutzung zum Zerkleinern verschiedener Nahrungspflanzen hin, darunter Wurzeln, Früchte und Blätter, aber auch härtere Pflanzenteile. Andere Steinwerkzeuge wurden in direkter Nachbarschaft zu Tierknochen entdeckt, wie die Wissenschaftler berichten. Insgesamt haben sie 1776 Knochen von meist größeren Tieren in Nyayanga gefunden, darunter Flusspferde, Urpferde, Säbelzahnkatzen und Rohrratten (Thryonomyidae), eine Gruppe von stachelschweinähnlichen Nagetieren. An einigen dieser Knochen waren Schnitt- und Schlagspuren erhalten, die darauf hindeuten, dass die an dieser Fundstelle einst präsenten Vor- oder Frühmenschen diese Tiere geschlachtet haben müssen. Vermutlich schnitten und schabten sie mit ihren Werkzeugen das Fleisch von den Knochen und zerschlugen die Beinknochen, um an das nahrhafte Knochenmark zu gelangen. „Das zeigt, dass der Oldowan-Werkzeugkasten genutzt wurde, um eine breite Vielfalt an pflanzlicher und tierischer Nahrung zu verarbeiten“, sagt Plummer.
Die Ausgrabungen lieferten auch einen ersten Hinweis darauf, wer diese Steinwerkzeuge vor rund 2,9 Millionen Jahren hergestellt haben könnte. Denn inmitten der Werkzeuge entdeckten die Wissenschaftler auch zwei Backenzähne eines Vormenschen der Gattung Paranthropus. Dieser gilt als Verwandter oder Abkömmling der Australopithecinen, war aber deutlich robuster und kräftiger als sie. „Bisher gingen Forscher davon aus, dass die Oldowan-Technologie von der Gattung Homo erfunden wurde“, sagt Potts. „Aber die Entdeckung des Paranthropus neben diesen Steinwerkzeugen eröffnet nun eine ganz neue Wendung in dieser faszinierenden Detektivgeschichte.“ Es wäre demnach möglich, dass die fortgeschrittene und bahnbrechende Oldowan-Technologie schon von diesem Vormenschen entwickelt wurde. Allerdings: „Auch die Gattung Homo war zur jener Zeit schon in Ostafrika präsent, auch wenn wir sie bisher nicht in Nyayanga gefunden haben. Daher können wir nicht mit Sicherheit sagen, zu welcher Homininenart diese Werkzeuge gehörten“, betonen die Wissenschaftler. In jedem Fall belegen die neuen Funde, dass die Oldowan-Steinwerkzeuge früher entstanden als bisher angenommen und dass sie schon damals weiter in Ostafrika verbreitet waren als nur im äthiopischen Afar-Dreieck.",None,None,10.1126/science.abo7452,"['Thomas W. Plummer: Department of Anthropology, Queens College, Flushing, NY, USA., The CUNY Graduate Center, New York, NY, USA., New York Consortium in Evolutionary Primatology, New York, NY, USA., Human Origins Program, National Museum of Natural History, Smithsonian Institution, Washington, DC, USA.', 'James S. Oliver: Anthropology Section, Illinois State Museum Springfield, IL, USA.', 'Emma M. Finestone: The Cleveland Museum of Natural History, Cleveland, OH, USA., Department of Archeology, Max Planck Institute for the Science of Human History, Jena, Germany.', 'Peter W. Ditchfield: School of Archeology, University of Oxford, Oxford, UK.', 'Laura C. Bishop: Research Centre in Evolutionary Anthropology and Paleoecology, School of Biological and Environmental Sciences, Liverpool John Moores University, Liverpool, UK., The Sino-British College, University of Shanghai for Science and Technology, Shanghai, China.', 'Scott A. Blumenthal: Human Origins Program, National Museum of Natural History, Smithsonian Institution, Washington, DC, USA., Department of Anthropology, University of Oregon, Eugene, OR, USA., University of British Columbia, Vancouver, BC, Canada.', 'Cristina Lemorini: LTFAPA Laboratory, Department of Classics, Sapienza University of Rome, Rome, Italy.', 'Isabella Caricola: LTFAPA Laboratory, Department of Classics, Sapienza University of Rome, Rome, Italy., School of History, Classics and Archeology, Newcastle University, Newcastle upon Tyne, UK.', 'Shara E. Bailey: New York Consortium in Evolutionary Primatology, New York, NY, USA., Department of Anthropology, New York University, New York, NY, USA.', 'Andy I. R. Herries: The Australian Archaeomagnetism Laboratory, Dept. Archaeology and History, La Trobe University, Melbourne Campus, 3086 Bundoora, Victoria, Australia., Paleo-Research Institute, University of Johannesburg, Johannesburg, South Africa.', 'Jennifer A. Parkinson: Human Origins Program, National Museum of Natural History, Smithsonian Institution, Washington, DC, USA., Department of Anthropology, University of San Diego, San Diego, CA, USA.', 'Elizabeth Whitfield: Research Centre in Evolutionary Anthropology and Paleoecology, School of Biological and Environmental Sciences, Liverpool John Moores University, Liverpool, UK.', 'Fritz Hertel: Department of Biology, California State University, Northridge, CA, USA.', 'Rahab N. Kinyanjui: Human Origins Program, National Museum of Natural History, Smithsonian Institution, Washington, DC, USA., National Museums of Kenya, Nairobi, Kenya., Max Planck Institute for Geoanthropology, Jena, Germany.', 'Thomas H. Vincent: Research Centre in Evolutionary Anthropology and Paleoecology, School of Biological and Environmental Sciences, Liverpool John Moores University, Liverpool, UK.', 'Youjuan Li: Department of Geoscience, University of Wisconsin-Madison, Madison, WI, USA., Institute of Geology, China Earthquake Administration, Beijing, China.', 'Julien Louys: Australian Research Centre for Human Evolution, Griffith University, Brisbane, Australia.', 'Stephen R. Frost: Department of Anthropology, University of Oregon, Eugene, OR, USA.', 'David R. Braun: Department of Anthropology, George Washington University, Washington, DC, USA., Max Planck Institute for Evolutionary Anthropology, Leipzig, Germany.', 'Jonathan S. Reeves: Max Planck Institute for Evolutionary Anthropology, Leipzig, Germany.', 'Emily D. G. Early: Human Origins Program, National Museum of Natural History, Smithsonian Institution, Washington, DC, USA., Arizona Museum of Natural History, Mesa, AZ, USA.', 'Blasto Onyango: National Museums of Kenya, Nairobi, Kenya.', 'Raquel Lamela-Lopez: The CUNY Graduate Center, New York, NY, USA., New York Consortium in Evolutionary Primatology, New York, NY, USA.', 'Frances L. Forrest: Department of Sociology and Anthropology, Fairfield University, Fairfield, CT, USA., American Museum of Natural History, New York, NY, USA.', 'Huaiyu He: Institute of Geology and Geophysics, Chinese Academy of Sciences, Beijing, China.', 'Timothy P. Lane: Research Centre in Evolutionary Anthropology and Paleoecology, School of Biological and Environmental Sciences, Liverpool John Moores University, Liverpool, UK.', 'Marine Frouin: Department of Geosciences, Stony Brook University, Stony Brook, NY, USA.', 'Sébastien Nomade: Laboratoire des Sciences du Climat et de l’Environnement, Université de Versailles Saint-Quentin and Paris Saclay, Gif Sur Yvette, France., Institut Pierre Simon Laplace, Guyancourt, France.', 'Evan P. Wilson: The CUNY Graduate Center, New York, NY, USA., New York Consortium in Evolutionary Primatology, New York, NY, USA.', 'Simion K. Bartilol: Institute of Nuclear Science and Technology, University of Nairobi, Nairobi, Kenya.', 'Nelson Kiprono Rotich: Institute of Nuclear Chemistry and Technology, Warsaw, Poland.', 'Richard Potts: Human Origins Program, National Museum of Natural History, Smithsonian Institution, Washington, DC, USA., National Museums of Kenya, Nairobi, Kenya.']",Science,"The oldest Oldowan tool sites, from around 2.6 million years ago, have previously been confined to Ethiopia’s Afar Triangle. We describe sites at Nyayanga, Kenya, dated to 3.032 to 2.581 million years ago and expand this distribution by over 1300 kilometers. Furthermore, we found two hippopotamid butchery sites associated with mosaic vegetation and a C 4 grazer–dominated fauna. Tool flaking proficiency was comparable with that of younger Oldowan assemblages, but pounding activities were more common. Tool use-wear and bone damage indicate plant and animal tissue processing. Paranthropus sp. teeth, the first from southwestern Kenya, possessed carbon isotopic values indicative of a diet rich in C 4 foods. We argue that the earliest Oldowan was more widespread than previously known, used to process diverse foods including megafauna, and associated with Paranthropus from its onset.",0.6443618,39,0
history-archaeology,Neandertaler jagten riesige Elefantenbullen,"Unsere archaischen Cousins erbeuteten auch die größten Landtiere ihrer Zeit, berichten Forscher: Im heutigen Deutschland machten Neandertaler-Gruppen vor 125.000 Jahren offenbar gezielt Jagd auf die bis zu 13 Tonnen schweren Bullen des Eurasischen Waldelefanten. Dies belegen Schlachtspuren an Überresten der Rüsseltiere von einem Fundort nahe Halle sowie weitere Indizien. Die Nutzung dieser besonders anspruchsvollen und ergiebigen Nahrungsquelle legt außerdem nahe, dass zumindest manche Neandertaler-Gruppen größer waren als bisher angenommen, sagen die Forscher.","Unsere archaischen Cousins erbeuteten auch die größten Landtiere ihrer Zeit, berichten Forscher: Im heutigen Deutschland machten Neandertaler-Gruppen vor 125.000 Jahren offenbar gezielt Jagd auf die bis zu 13 Tonnen schweren Bullen des Eurasischen Waldelefanten. Dies belegen Schlachtspuren an Überresten der Rüsseltiere von einem Fundort nahe Halle sowie weitere Indizien. Die Nutzung dieser besonders anspruchsvollen und ergiebigen Nahrungsquelle legt außerdem nahe, dass zumindest manche Neandertaler-Gruppen größer waren als bisher angenommen, sagen die Forscher.

Er überragte die heutigen Elefanten und auch das Mammut deutlich: Mit einer Schulterhöhe von bis zu über vier Metern und einem Gewicht von maximal 13 Tonnen war der Eurasische Waldelefant das größte Landtier im Zeitalter des Pleistozäns. Mit ihren charakteristisch geraden, bis zu drei Meter langen Stoßzähnen waren sie damals in den Wäldern Europas und Westasiens unterwegs. Während der Zwischenwarmzeiten des Pleistozäns erstreckte sich ihr Verbreitungsgebiet dabei auch in Bereiche nördlich der Alpen – so auch in der Zeit vor etwa 125.000 Jahren.
Wie aus zahlreichen Funden bekannt ist, lebten dort damals auch Neandertaler. Bisher blieb allerdings unklar, ob unsere archaischen Cousins Jagd auf die gigantischen Rüsseltiere machten. Denn bisherige Hinweise waren auch damit zu erklären, dass sie sich nur bei Gelegenheit über die Kadaver von Tieren hermachten, die eines natürlichen Todes gestorben waren. Die Grundlage der Studie der Forscher um Sabine Gaudzinski-Windheuser von der Johannes-Gutenberg-Universität Mainz bildeten nun frühere sowie neue Untersuchungsergebnisse von Funden in einer Braunkohlegrube bei Neumark-Nord in der Nähe von Halle. Dort wurden bereits in den 1980er und 1990er Jahren die Überreste von mindestens 70 Waldelefanten entdeckt. Den Datierungen zufolge stammen sie von Tieren, die dort vor rund 125.000 Jahren im Bereich eines einstigen Sees gelebt haben.
Bisherige Untersuchungen hatten bereits interessante Besonderheiten bei den Funden aufgedeckt. Es handelt sich demnach um eine Ansammlung von Individuen mit einer seltsamen Unausgewogenheit: Die Forscher identifizierten fast nur ausgewachsene männliche Tiere. Dieses Muster wurde bisher weder bei fossilen noch bei heutigen Elefantenpopulationen beobachtet. Anfang 2021 folgten dann spannende Befunde an einigen Knochen: „Die Entdeckung von eindeutigen Schnittspuren gab den Anstoß zu einer intensiven Untersuchung der Elefantenüberreste“, sagt Gaudzinski-Windheuser. Für die aktuelle Studie hat das Forschungsteam die 3122 Einzelstücke umfassende Knochensammlung akribisch analysiert. Sie suchten dabei nach Schnittspuren von Steinwerkzeugen sowie nach Bissmarken von Raubtieren.
Wie das Team berichtet, stellten sie tatsächlich bei den meisten Individuen die Signaturen menschlicher Aktivität fest. Demnach dienten die Tiere über mindestens 2000 Jahre hinweg Neandertalern als Nahrungsquelle. Der Vergleich mit Bissspuren deutete dabei darauf hin, dass die Neandertaler vor Raubtieren am Werk gewesen sein müssen. Den deutlichsten Hinweis darauf, dass die Elefanten von den Frühmenschen getötet worden waren, sehen die Forscher allerdings in den demografischen Daten: In ihrer Studie erklären sie, warum die überdurchschnittliche Häufigkeit von erwachsenen Männchen unter den toten Tieren deutlich für eine Bejagung spricht.
Demnach waren die Bullen wohl eine vergleichsweise einfache und trotzdem besonders fette Beute. Denn die einzelgängerischen Männchen waren im Gegensatz zu den Weibchen und Jungtieren ohne den Schutz der Herde unterwegs. So konnten sich die Jäger ihnen vermutlich einfacher nähern und sie durch Fallen oder massiven Speer-Einsatz überwältigen, argumentieren die Wissenschaftler. Der Gewinn bei einem Jagderfolg war enorm, geht aus ihren Berechnungen hervor: Ein zehn Tonnen schwerer Elefant könnte demnach 2500 Portionen zu jeweils 4000 Kilokalorien geliefert haben.
Wie das Team erklärt, werfen die Ergebnisse nun auch neues Licht auf die Lebensweise der Neandertaler. Klar scheint: Die Jagd auf die riesigen Tiere erforderte wohl eine enge Zusammenarbeit zwischen den beteiligten Gruppenmitgliedern. Dies galt auch für die Verarbeitung der Beute: Die Tiere mussten zerlegt werden, Fleischreste waren von den langen Knochen abzulösen und die fettreichen Fußpolster zu entfernen. Zur Verarbeitung gehörte möglicherweise außerdem das Trocknen des Materials für die Langzeitlagerung.
Den Forschern zufolge wirkt wenig plausibel, dass dies von kleinen Gruppen bewerkstelligt werden konnte. Bislang wurde angenommen, dass sich Neandertaler in Gruppen von höchstens 25 Individuen zusammengefunden haben. Es erscheint nun hingegen wahrscheinlich, dass sie zumindest zeitweise auch größere Gemeinschaften bildeten und vielleicht auch Konservierungstechniken für die Lagerung von Nahrungsmitteln nutzen. In einem Kommentar zur Studie schreibt Britt Starkovich von der Universität Tübingen dazu abschließend: „Es wird immer deutlicher, dass die Neandertaler über ein ganzes Arsenal an adaptiven Verhaltensweisen verfügten, die es ihnen ermöglichten, in den vielfältigen Ökosystemen Eurasiens über 200.000 Jahre lang erfolgreich zu sein“, so die Wissenschaftlerin.",None,None,10.1126/sciadv.add8186,"['Sabine Gaudzinski-Windheuser: MONREPOS Archaeological Research Center and Museum for Human Behavioral Evolution, Schloss Monrepos, Neuwied 56567, Germany (LEIZA)., Institute of Ancient Studies, Pre- and Protohistoric Archaeology, Johannes Gutenberg University of Mainz, Schönborner Hof, Schillerstraße 11, Mainz 55116, Germany.', 'Lutz Kindler: MONREPOS Archaeological Research Center and Museum for Human Behavioral Evolution, Schloss Monrepos, Neuwied 56567, Germany (LEIZA)., Institute of Ancient Studies, Pre- and Protohistoric Archaeology, Johannes Gutenberg University of Mainz, Schönborner Hof, Schillerstraße 11, Mainz 55116, Germany.', 'Katharine MacDonald: Faculty of Archaeology, Leiden University, P.O. Box 9514, 2300 RA Leiden, Netherlands.', 'Wil Roebroeks: Faculty of Archaeology, Leiden University, P.O. Box 9514, 2300 RA Leiden, Netherlands.']",Science Advances,"Straight-tusked elephants ( Palaeoloxodon antiquus ) were the largest terrestrial mammals of the Pleistocene, present in Eurasian landscapes between 800,000 and 100,000 years ago. The occasional co-occurrence of their skeletal remains with stone tools has generated rich speculation about the nature of interactions between these elephants and Pleistocene humans: Did hominins scavenge on elephants that died a natural death or maybe even hunt some individuals? Our archaeozoological study of the largest P. antiquus assemblage known, excavated from 125,000-year-old lake deposits in Germany, shows that hunting of elephants weighing up to 13 metric tons was part of the cultural repertoire of Last Interglacial Neanderthals there, over >2000 years, many dozens of generations. The intensity and nutritional yields of these well-documented butchering activities, combined with previously reported data from this Neumark-Nord site complex, suggest that Neanderthals were less mobile and operated within social units substantially larger than commonly envisaged.",0.7433189,40,0
