topic,title,pls,article_full_text,fk_score,ari_score,reference,authors_info,journey,abstract,simirality,id,pdf_exist
history-archaeology,„Knochen-Döschen“ mit spannendem Inhalt,"Sie kamen als Schmerz- oder Rauschmittel zum Einsatz: Bilsenkraut-Samen in einem Knochen-Gefäß von einem römischen Fundort in den Niederlanden belegen die pharmakologische Nutzung des giftigen Nachtschattengewächses in der Antike. Die Entdeckung bestätigt damit historische Überlieferungen und legt einen weitverbreiteten Einsatz des besonderen Krauts im Römischen Reich nahe, sagen die Archäologen.","Sie kamen als Schmerz- oder Rauschmittel zum Einsatz: Bilsenkraut-Samen in einem Knochen-Gefäß von einem römischen Fundort in den Niederlanden belegen die pharmakologische Nutzung des giftigen Nachtschattengewächses in der Antike. Die Entdeckung bestätigt damit historische Überlieferungen und legt einen weitverbreiteten Einsatz des besonderen Krauts im Römischen Reich nahe, sagen die Archäologen.

„Die Dosis macht das Gift“: Diese Regel gilt bekanntlich für viele Wirkstoffe und beim Schwarzen Bilsenkraut (Hyoscyamus niger) ist dies ganz besonders der Fall. Diese in Europa weitverbreitete Vertreterin der Nachtschattengewächse bildet potenziell lebensgefährliche Alkaloide. In geringer Dosierung haben sie dagegen eine psychoaktive Wirkung: Es kommt zu Halluzinationen oder Rauschzuständen. Vermutlich schon seit Urzeiten wird das Bilsenkraut aber auch für medizinische Zwecke verwendet. Schriftlich belegt ist dies bei antiken Autoren wie dem römischen Gelehrten Plinius dem Älteren (23 bis 79 n. Chr.). Sie berichten von der Wirkung und Verwendung von Pflanzen die sich den Bilsenkräutern zuordnen lassen. Vor allem wird die schmerzstillende Wirkung beschrieben. Die antiken Autoren berichten aber auch von den halluzinogenen Effekten und warnen vor der Vergiftungsgefahr.
Bisher gab es aber nur wenige direkte Hinweise auf die pharmakologische Nutzung von Bilsenkraut. Es wurden zwar auffallend häufig Samen oder sonstige Überreste der Pflanzen an archäologischen Fundorten entdeckt. Es ließ sich dabei aber meist nicht eindeutig klären, ob die Pflanzen gezielt genutzt wurden, oder ob sie nur natürlicherweise an den archäologischen Stätten gewachsen waren. Bei der Entdeckung, über die das Forschungsteam um Maaike Groot von der Freien Universität Berlin berichtet, zeichnet sich nun dagegen der praktische Einsatz des Krauts eindeutig ab. Der Fund stammt von der Ausgrabungsstätte „Houten-Castellum“ in den Niederlanden. Dort befand sich in der Ära der römischen Herrschaft über die Region eine ländliche Siedlung.
Wie das Team berichtet, handelt es sich bei der Entdeckung um das etwa sieben Zentimeter lange Stück eines Beinknochens eines Schafs oder einer Ziege. Das weiche Knochenmaterial in der Mitte war offenbar gezielt beseitigt worden, um das Knochenstück in ein Gefäß zu verwandeln. Verschlossen war es durch einen Pfropfen, bei dem es sich den Untersuchungsergebnissen zufolge um einen Klumpen Birkenpech handelt. Dieser Verschluss verhinderte offenbar einst, dass der feinkörnige Inhalt herausrieselte: Die Forschenden entdeckten in dem Knochen-Gefäß hunderte von Samen. Wie die anschließenden Untersuchungen zeigten, stammen sie ausschließlich vom Schwarzen Bilsenkraut.
Damit lag nahe, dass der Behälter zur Aufbewahrung der pharmakologisch wirksamen Gebilde gedient hat. Die Forschenden gingen aber auch einer weiteren Möglichkeit nach: War das Knochenstück vielleicht eine Art Pfeife zum Rauchen der Samen? Wie das Team berichtet, spricht gegen diese Theorie das Fehlen von Spuren einer Erhitzung oder Verkohlung an dem Kochen beziehungsweise an den Samen. Außerdem hätte eine Inhalation von Rauch oder Ausdünstungen der besonders wirkstoffhaltigen Samen wohl leicht zu einer lebensgefährlichen Überdosierung geführt, sagen die Forschenden.
Sie gehen deshalb davon aus, dass es sich um eine Art Medizin-Fläschchen gehandelt hat. Wie und wofür die Samen genau eingesetzt wurden, bleibt allerdings unklar. Aber zumindest handelt es sich bei dem Gefäß nun um ein direktes Zeugnis des pharmakologischen Nutzens des Bilsenkrauts in der Römerzeit. Bisher stammte der älteste Fund eines Behälters mit Teilen dieser Pflanze dagegen aus dem mittelalterlichen Dänemark. „Außerdem belegen unsere Forschungsergebnisse, dass Bilsenkraut offenbar auch in ländlichen Siedlungen an der Peripherie des Römischen Reiches zum Einsatz kam“, hebt Groot abschließend hervor.",None,None,10.15184/aqy.2024.5,"['Maaike Groot: ', 'Martijn van Haasteren: ', 'Laura I. Kooistra: ']",Antiquity,The remains of black henbane (Hyoscyamus niger) are relatively common at archaeological sites as it grows naturally around settlements in north-western Europe. All parts of the plant may be used as a medicine or a narcotic but its natural prevalence in built environments makes it difficult to interpret any intentionality behind its presence in the archaeological record. Evidence of the deliberate collection and use of black henbane seeds in the Roman Netherlands is presented here for the first time. Examination of Classical texts and interrogation of the archaeobotanical data allow the authors to place the discovery at Houten-Castellum of a hollowed bone containing hundreds of black henbane seeds within the context of the wider Roman understanding of the plant and its properties.,0.59591454,0,0
history-archaeology,Komponentenkleber schon bei den Neandertalern?,"Klebstoffe gelten als eines der frühesten Zeichen der kulturellen Evolution des Menschen. Eine Studie legt nun nahe, dass bereits die Neandertaler komplexe Klebstoffe herstellten. An mehr als 40.000 Jahre alten Steinwerkzeugen aus einer Fundstätte in Frankreich haben Forschende Spuren eines Klebstoffs aus Bitumen und Ocker festgestellt. Wahrscheinlich nutzten Neandertaler die Mischung, um ihre Steinwerkzeuge mit Griffen zu versehen. Dabei könnte der Ocker dafür gesorgt haben, dass der fertige Griff nicht an den Händen klebte.
","Klebstoffe gelten als eines der frühesten Zeichen der kulturellen Evolution des Menschen. Eine Studie legt nun nahe, dass bereits die Neandertaler komplexe Klebstoffe herstellten. An mehr als 40.000 Jahre alten Steinwerkzeugen aus einer Fundstätte in Frankreich haben Forschende Spuren eines Klebstoffs aus Bitumen und Ocker festgestellt. Wahrscheinlich nutzten Neandertaler die Mischung, um ihre Steinwerkzeuge mit Griffen zu versehen. Dabei könnte der Ocker dafür gesorgt haben, dass der fertige Griff nicht an den Händen klebte.
Die ersten Steinwerkzeuge schufen unsere frühmenschlichen Vorfahren wahrscheinlich schon vor rund 2,6 Millionen Jahren. Ab wann die Herstellung solcher Steinhämmer und Klingen allerdings bewusst und zielgerichtet erfolgte, ist unklar. Ein deutliches Zeichen für einen kulturtechnologischen Prozess ist dagegen die Verwendung von Klebstoff, beispielsweise um Werkzeuge mit Griffen zu versehen. Von Neandertalern ist bekannt, dass sie Birkenpech nutzten, das sie wahrscheinlich bereits vor 80.000 Jahren gezielt herstellten.
Noch einen Schritt weiter gehen Klebstoffe, die sich aus mehreren Zutaten zusammensetzen. „Vom afrikanischen Homo sapiens ist bekannt, dass er zusammengesetzte Klebstoffe aus natürlich vorkommenden klebrigen Substanzen und Ocker herstellte, ein technisches Verhalten, von dem angenommen wird, dass es das Aufkommen ausgefeilter kognitiver Prozesse bei unserer Spezies markiert“, erklärt ein Team um Patrick Schmidt von der Universität Tübingen. „In Europa dagegen waren vor Beginn des Jungpaläolithikums vor etwa 40.000 Jahren bisher keine ockerhaltigen Klebstoffe bekannt, weder von Neandertalern noch von den frühesten europäischen Homo sapiens.“ Als Jungpaläolithikum wird die jüngste, letzte Epoche der Altsteinzeit bezeichnet, die mit der Ankunft des Homo sapiens in Europa begann und mit dem Ende der Eiszeit endete.
Doch an mehreren zuvor nicht näher untersuchten Museumsexemplaren hat das Team nun ältere Nachweise von zusammengesetzten Klebstoffen entdeckt. Die Artefakte stammen aus der Fundstelle Le Moustier im heutigen Frankreich, wo vor etwa 120.000 bis 40.000 Jahren Neandertaler lebten. „Die Sammlungsstücke waren einzeln verpackt und seit den 1960er Jahren unberührt. Dadurch waren die anhaftenden Reste organischer Stoffe sehr gut erhalten“, berichtet Schmidts Kollegin Ewa Dutkiewicz. Genau diese organischen Reste weckten das Interesse der Forschenden. Chemische und spektroskopische Analysen ergaben, dass es sich dabei um ein Gemisch aus Ocker und dem klebrigen Rohstoff Bitumen handelte. Bitumen, ein Bestandteil von Asphalt, kann aus Erdöl hergestellt werden, kommt aber auch natürlich vor, teils als zähe Flüssigkeit, teils als luftgetrocknete feste Masse.
Zu ihrer Überraschung stellten die Forschenden fest, dass der Ockeranteil der Mischung bei mehr als 50 Prozent lag. „Ein so hoher Ockeranteil beeinträchtigt die Klebeleistung für klassische Einsatzzwecke, bei denen Steinwerkzeuge beispielsweise an Holzgriffe geklebt werden“, erklären Schmidt und seine Kollegen. Aus früheren Funden war allerdings bereits bekannt, dass die Neandertaler die klebrigen Materialien oft selbst als Handgriff benutzten, statt damit andere Materialien zu verbinden.
Um herauszufinden, inwieweit verschiedene Mischungen aus Bitumen und Ocker für diesen Einsatzzweck geeignet sind, experimentierten die Forschenden selbst mit den beiden Rohstoffen und testeten die Mischungen auf Klebekraft und weitere Eigenschaften. Dazu nutzten sie natürlich vorkommendes Bitumen aus Frankreich, sowohl in der luftgetrockneten Form, als auch als flüssige Masse. Um das flüssige Bitumen besser nutzbar zu machen, kochten sie es, bevor sie es mit unterschiedlichen Anteilen an Ocker mischten.
Erwartungsgemäß klebte das luftgetrocknete Bitumen am stärksten und verlor durch Zugabe von Ocker zunehmend seine Klebekraft. Allerdings hatte es einen gravierenden Nachteil: Versuchten Schmidt und seine Kollegen, daraus einen Griff für Steinwerkzeuge zu formen, blieben jedes Mal Teile des Materials an ihren Händen kleben. Zudem war der Griff nicht fest genug und dadurch unbrauchbar. „Anders war es, als wir flüssiges Bitumen einsetzten, das sich pur zum Kleben eigentlich gar nicht eignet“, sagt Schmidt. „Fügt man 55 Prozent Ocker hinzu, erhält man eine formbare Masse.“ Diese ist gerade klebrig genug, um das Steinwerkzeug zu fixieren, wohingegen die Hände sauber bleiben. Zudem verleiht der Ocker dem Material Festigkeit.
Mikroskopische Analysen der Abnutzungsspuren an den Werkzeugen ergaben, dass auch die steinzeitlichen Griffe wahrscheinlich genau auf diese Weise erzeugt und genutzt wurden. „Solche technologischen Entwicklungen und das Verständnis für Materialeigenschaften lassen sich als erster Ausdruck umfassender kognitiver Prozesse der Menschen betrachten, die unserer heutigen Denkweise bei industriellen Prozessen entsprechen“, sagt Schmidt. Wahrscheinlich mussten die Frühmenschen Ocker und Bitumen aus weit voneinander entfernten Orten zusammentragen, was einen großen Aufwand bedeutet, viel Planung erfordert und auf eine gezielte Vorgehensweise hindeutet.
„Unter Einbeziehung des Fundzusammenhangs gehen wir davon aus, dass das aufwendig produzierte Klebematerial von Neandertalern hergestellt wurde“, sagt Dutkiewicz. Das deutet darauf hin, dass die Neandertaler zu ähnlichen kognitiven Leistungen in der Lage waren wie der frühe Homo sapiens in Afrika. „Beide investierten Zeit und Mühe in die Herstellung von Verbundklebstoffen und verfügten über die erforderlichen kognitiven Fähigkeiten“, schreiben die Forschenden. „Diese Fähigkeit und die Bereitschaft, in Werkzeuge zu investieren, die mit hohem Aufwand verbunden waren, dokumentieren die Komplexität des Verhaltens der Homininen im späten Mittelpaläolithikum.“",None,None,10.1126/sciadv.adl0822,"['Patrick Schmidt: Early Prehistory and Quaternary Ecology, Department of Geosciences, Eberhard Karls University of Tübingen, Tübingen, Germany., Applied Mineralogy, Department of Geosciences, Eberhard Karls University of Tübingen, Tübingen, Germany.', 'Radu Iovita: Center for the Study of Human Origins, Department of Anthropology, New York University, New York, NY 10003, USA.', 'Armelle Charrié-Duhaut: Laboratoire de spectrométrie de masse des interactions et des systèmes (LSMIS), Strasbourg University, CNRS, CMC UMR, Strasbourg 7140, France.', 'Gunther Möller: Early Prehistory and Quaternary Ecology, Department of Geosciences, Eberhard Karls University of Tübingen, Tübingen, Germany.', 'Abay Namen: Early Prehistory and Quaternary Ecology, Department of Geosciences, Eberhard Karls University of Tübingen, Tübingen, Germany., Department of Sociology and Anthropology, School of Sciences and Humanities, Nazarbayev University, Astana, Kazakhstan.', 'Ewa Dutkiewicz: Early Prehistory and Quaternary Ecology, Department of Geosciences, Eberhard Karls University of Tübingen, Tübingen, Germany., Staatliche Museen zu Berlin, Museum für Vor- und Frühgeschichte, Berlin, Germany.']",Science Advances,"Ancient adhesives used in multicomponent tools may be among our best material evidences of cultural evolution and cognitive processes in early humans. African Homo sapiens is known to have made compound adhesives from naturally sticky substances and ochre, a technical behavior proposed to mark the advent of elaborate cognitive processes in our species. Foragers of the European Middle Paleolithic also used glues, but evidence of ochre-based compound adhesives is unknown. Here, we present evidence of this kind. Bitumen was mixed with high loads of goethite ochre to make compound adhesives at the type-site of the Mousterian, Le Moustier (France). Ochre loads were so high that they lowered the adhesive’s performance in classical hafting situations where stone implements are glued to handles. However, when used as handheld grips on cutting or scraping tools, a behavior known from Neanderthals, high-ochre adhesives present a real benefit, improving their solidity and rigidity. Our findings help understand the implications of Pleistocene adhesive making.",0.7090102,1,0
history-archaeology,Dem Ursprung der Osterinsel-Schrift auf der Spur,"Sie ist bis heute nicht entziffert und geheimnisumwittert: Wann und wie haben die Bewohner der Osterinsel ihre mysteriöse Rongorongo-Schrift entwickelt? Die Datierung einer der erhaltenen Tafel bestärkt nun die These, wonach das Volk der Rapanui diese Schrift tatsächlich eigenständig, ohne europäisches Vorbild entwickelt hat. Das Holz, in das die Glyphen geritzt wurden, stammt demnach aus dem fünfzehnten Jahrhundert – die ersten Europäer erreichten die Insel aber erst rund 200 Jahre später. Dennoch kann der Befund die frühe Entwicklung des Schriftsystems noch immer nicht eindeutig beweisen, erklären die Autoren.","Sie ist bis heute nicht entziffert und geheimnisumwittert: Wann und wie haben die Bewohner der Osterinsel ihre mysteriöse Rongorongo-Schrift entwickelt? Die Datierung einer der erhaltenen Tafel bestärkt nun die These, wonach das Volk der Rapanui diese Schrift tatsächlich eigenständig, ohne europäisches Vorbild entwickelt hat. Das Holz, in das die Glyphen geritzt wurden, stammt demnach aus dem fünfzehnten Jahrhundert – die ersten Europäer erreichten die Insel aber erst rund 200 Jahre später. Dennoch kann der Befund die frühe Entwicklung des Schriftsystems noch immer nicht eindeutig beweisen, erklären die Autoren.

Die majestätischen Moai haben die Osterinsel berühmt gemacht: Die Steinkolosse zeugen von einer erstaunlichen und noch immer rätselhaften Kultur, die sich einst auf der entlegenen Pazifikinsel entwickelt hat. Man geht davon aus, dass das Volk der Rapanui aus polynesischen Seefahrern hervorgegangen ist. Wann sie auf der extrem isoliert gelegenen Insel angekommen sind, ist unklar – möglicherweise erst im 12. Jahrhundert n. Chr. Klar ist: Die Siedler brachten dort schließlich eine erstaunlich leistungsfähige Gesellschaft hervor, die sich in den monumentalen Kultplätzen und Statuen der Insel widerspiegelt. Inwieweit die Kultur bereits von einem Niedergang gezeichnet war, als im Jahr 1722 die ersten Europäer auf der Insel ankamen, ist strittig. Doch der völlige Kollaps der Kontinuität setzte erst in der Folge ein: Sklavenhändler beuteten die Bevölkerung aus, eingeschleppte Krankheiten rafften sie dahin und Missionare kamen auf die Insel. Um 1877 waren offenbar nur noch knapp über 100 Rapanui übriggeblieben. Die meisten Informationen über die traditionelle Kultur waren dadurch verloren gegangen.
Dies betraf auch einen besonders geheimnisvollen Aspekt der Kultur: Die Bewohner der Insel hatten offenbar eine Schrift entwickelt, über die erst im Jahr 1864 berichtet wurde. Es handelt sich um komplexe Zeichenfolgen, die in Holzstücke geritzt wurden. Viele dieser Glyphen-Tafeln wurden offenbar im Zuge der Missionierung absichtlich vernichtet – nur 27 Exemplare befinden sich heute in verschiedenen Sammlungen der Welt. Die sogenannten Rongorongo-Zeichen besitzen eindeutig die Merkmale eines Schriftsystems. Den Glyphen-Folgen können aber kaum Bedeutungen zugeordnet werden – die Schrift ist bis heute nicht entziffert. Genauso mysteriös ist auch ihr Ursprung, denn aus anderen Teilen des polynesischen Kulturkreises ist kein Schriftsystem bekannt.
Die Rapanui könnten ihre Schrift demnach eigenständig entwickelt haben, was in der Menschheitsgeschichte eine Besonderheit darstellt. Doch dieser Annahme widerspricht bisher ein Einwand: Es erscheint möglich, dass die Inselbewohner die Schrift erst entwickelt haben, nachdem sie das Konzept bei den europäischen Seefahrern kennengelernt haben. So könnte sie auf die Idee gekommen sein, eigene Symbole für ein Schriftsystem zu nutzen, so der Erklärungsansatz. Wenn diese These zutrifft, dürfte es also keine Schriftzeugnisse geben, die älter als der früheste Kontakt der Inselbewohner mit Europäern sind. Somit kommt der Datierung der Rongorongo-Tafeln eine besondere Bedeutung zu.
Bisher wurden aber nur Proben von zwei Tafeln einer Radiokarbondatierung unterzogen. Die Ergebnisse verwiesen dabei auf die 1800er Jahre für das Fälldatum der Bäume, die das Holz für die Inschriften geliefert haben. Diese Ergebnisse passten somit zu der Adaptions-Hypothese, schlossen aber nicht aus, dass andere Exemplare älter sein könnten. Deshalb hat nun das Forschungsteam um Silvia Ferrara von der Universität von Bologna vier weitere Rongorongo-Tafeln einer Radiokarbondatierung unterzogen, die in einer Sammlung in Rom aufbewahrt werden.
Wie das Team berichtet, ergaben diese Analysen: Bei drei Exemplaren zeigte sich erneut ein Fälldatum der Bäume in der Zeit nach dem Erstkontakt von 1722. Doch bei der Rongorongo-Tafel mit der Bezeichnung „Échancrée“ war das nicht der Fall: Die Analysen ergaben eine besonders sichere Datierung auf das 15. Jahrhundert. Dieses Ergebnis liefert damit einen Hinweis auf die Verwendung der Schrift in einem Zeitraum vor der Ankunft externer Einflüsse und damit auf eine völlig eigenständige Entwicklung, sagen die Forschenden.
Man könnte nun meinen, der Fall sei geklärt. Doch wie die Autoren betonen, bleibt ein erheblicher Unsicherheitsfaktor: Die Datierung kreist zwar die Fällzeit des Holz-liefernden Baumes ein – sie muss aber nicht unbedingt mit der Zeit der Beschriftung zusammenfallen. Mit anderen Worten: Es könnte altes Holz verwendet worden sein. Dafür gibt es sogar mögliche Anhaltspunkte. Denn eine frühere Untersuchung der Holzstruktur der Échancrée-Tafel hatte nahegelegt, dass das Stück von einem Baum aus der Familie der Steineiben stammt. Diese Gewächse kommen aber auf der Osterinsel nicht vor. Es könnte sich demnach um Treibholz gehandelt haben, das möglicherweise von Südamerika aus das Inselufer erreicht hat. Auf der weitgehend entwaldeten Insel könnte solches Holz intensiv genutzt worden sein.
Wie alt das Material der Échancrée-Tafel schon war, als die Glyphen eingeritzt wurden, erscheint deshalb unklar. Dennoch halten die Wissenschaftler eine Beschriftung der Échancrée-Tafel vor 1722 für wahrscheinlich. Damit handelt es sich zumindest um einen weiteren Hinweis darauf, dass den geheimnisvollen Glyphen eine enorme Bedeutung zukommen könnte: „Rongorongo könnte eine der wenigen unabhängigen Erfindungen der Schrift in der Geschichte der Menschheit darstellen, was die kulturellen Entwicklungen der Bewohner der Osterinsel noch komplexer erscheinen lässt“, schreiben die Autoren abschließend.",None,None,10.1038/s41598-024-53063-7,"['Silvia Ferrara: ', 'Laura Tassoni: ', 'Bernd Kromer: ', 'Lukas Wacker: ', 'Michael Friedrich: ', 'Francesca Tonini: ', 'Lorenzo Lastilla: ', 'Roberta Ravanelli: ', 'Sahra Talamo: ']",Scientific Reports,"Placing the origin of an undeciphered script in time is crucial to understanding the invention of writing in human history. Rapa Nui, also known as Easter Island, developed a script, now engraved on fewer than 30 wooden objects, which is still undeciphered. Its origins are also obscure. Central to this issue is whether the script was invented before European travelers reached the island in the eighteenth century AD. Hence direct radiocarbon dating of the wood plays a fundamental role. Until now, only two tablets were directly dated, placing them in the nineteenth c. AD, which does not solve the question of independent invention. Here we radiocarbon-dated four Rongorongo tablets preserved in Rome, Italy. One specimen yielded a unique and secure mid-fifteenth c. date, while the others fall within the nineteenth c. AD. Our results suggest that the use of the script could be placed to a horizon that predates the arrival of external influence.",0.68482035,2,0
