topic,title,pls,article_full_text,fk_score,ari_score,reference,authors_info,journey,abstract,simirality,id,pdf_exist
history-archaeology,Ursprünge der indoeuropäischen Sprachfamilie,"Fast die Hälfte der Weltbevölkerung spricht eine indoeuropäische Sprache – auch das Deutsche gehört dazu. Doch wann und wo ist die Sprachfamilie entstanden und wie hat sie sich diversifiziert und ausgebreitet? Eine Analyse von 161 modernen und nicht-modernen Sprachen zeigt nun, dass die Sprachfamilie wahrscheinlich vor rund 8.120 Jahren südlich des Kaukasus entstand, sich später in nördlichen Steppenregionen verzweigte und von dort aus über Eurasien ausbreitete. Die Ergebnisse vereinen frühere Hypothesen und stimmen auch mit DNA-Belegen für die Ausbreitung der beteiligten Volksstämme überein.
","Fast die Hälfte der Weltbevölkerung spricht eine indoeuropäische Sprache – auch das Deutsche gehört dazu. Doch wann und wo ist die Sprachfamilie entstanden und wie hat sie sich diversifiziert und ausgebreitet? Eine Analyse von 161 modernen und nicht-modernen Sprachen zeigt nun, dass die Sprachfamilie wahrscheinlich vor rund 8.120 Jahren südlich des Kaukasus entstand, sich später in nördlichen Steppenregionen verzweigte und von dort aus über Eurasien ausbreitete. Die Ergebnisse vereinen frühere Hypothesen und stimmen auch mit DNA-Belegen für die Ausbreitung der beteiligten Volksstämme überein.
Die meisten Sprachen, die heute in Europa gesprochen werden, gehören der indoeuropäischen Sprachfamilie an. Zu ihr zählen die germanischen, romanischen, slawischen, baltischen und keltischen Sprachen, ebenso wie Griechisch, Albanisch, Armenisch und die indo-iranische Sprachgruppe. Die Bezeichnung indoeuropäisch, teils auch indogermanisch, bezog sich ursprünglich auf die angenommene geographische Verbreitung der Sprachen. Heutzutage werden indoeuropäische Sprachen jedoch weit über Europa hinaus in vielen Teilen der Welt gesprochen – nicht zuletzt durch den Kolonialismus – und es hat sich herausgestellt, dass auch die Ursprünge der Sprachfamilie außerhalb von Europa liegen.
Wann und wo genau die Sprachfamilie jedoch entstanden ist, war bislang umstritten. Eine verbreitete Hypothese, die sogenannte Steppen-Hypothese, ging davon aus, dass die Ursprünge der Sprachfamilie vor rund 6.500 Jahren in der pontisch-kaspischen Steppe liegen. Demnach hätten berittene nomadische Steppenvölker vor rund 5.000 Jahren die Sprachen verbreitet. Eine andere Hypothese, die sogenannte Agrar-Hypothese, sieht den Ursprung der indoeuropäischen Sprachen vor 8.500 bis 9.500 Jahren südlich des Kaukasus im fruchtbaren Halbmond in Anatolien. Demnach hätten sich die Sprachen dieser Familie mit dem Ackerbau über Europa ausgebreitet.
Ein Team um Paul Heggarty vom Max-Planck-Institut für Evolutionäre Anthropologie in Leipzig ist nun den Ursprüngen unserer Sprachen genauer auf den Grund gegangen. Dazu analysierten die Forschenden über 100 moderne und 52 nicht-moderne Sprachen auf verwandte Wortursprünge im Kernwortschatz. Mit linguistischen Methoden erstellten sie auf diese Weise einen Stammbaum der Sprachen. Zusätzlich bezogen sie auch genetische Hinweise mit ein, die anhand von alter DNA Auskunft darüber geben, wie sich bestimmte historische Volksgruppen verbreitet haben.
„Unsere Ergebnisse stimmen weder mit der Steppen- noch mit der Agrar-Hypothese vollständig überein“, berichtet das Team. „Unsere Analysen ergaben, dass die Wurzeln der indoeuropäischen Sprachen rund 8.120 Jahren zurückgehen – zu früh für die Steppen-Hypothese.“ Zugleich legten jedoch Hinweise aus alter DNA nahe, dass die frühen Sprecher vieler Zweige der Sprachfamilie ihre Ursprünge in der Steppe haben. Im anatolischen und griechischen Raum sowie in weiten Teilen Asiens zeigten sich Hinweise auf eine solche Steppenherkunft jedoch nicht.
Auch die Verwandtschaftsverhältnisse der Sprachen warfen Fragen auf. „Frühere Analysen gingen davon aus, dass sich moderne Sprachen direkt aus früheren geschriebenen Sprachen entwickelt haben, statt aus parallel verwendeten, nur gesprochenen Variationen“, erklären die Forschenden. Dadurch hätte sich ein verzerrtes Bild der Sprachverwandtschaft ergeben. Die neue Analyse verzichtete dagegen auf diese Annahme und führte so zu einem neuen Stammbaum, der besser mit den Hinweisen aus alter DNA in Einklang zu bringen ist.
Demnach entstanden die indoeuropäischen Sprachen, in Übereinstimmung mit der Agrar-Hypothese, tatsächlich südlich des Kaukasus, und zwar vor rund 8.120 Jahren. Einige Zweige der Sprachfamilie, darunter die indo-iranische Sprachgruppe sowie Griechisch und Albanisch, zweigten direkt von dort ab. Vor etwa 7.000 Jahren gelangten Sprecher der damaligen indoeuropäischen Sprache in die pontisch-kaspische Steppe nördlich des Kaukasus. „Die Steppe bildet somit die sekundäre Heimat für einige Zweige des Indoeuropäischen, die mit späteren Expansionen nach Europa kamen“, erklären Heggarty und sein Team. So gehen unter anderem die germanischen, baltischen und keltischen Sprachen wahrscheinlich auf die Steppenvölker zurück.
„Die Kombination aus Sprachphylogenetik und alter DNA deutet also darauf hin, dass die Lösung des Rätsels der indoeuropäischen Sprachen in einer Mischung aus der Agrar- und der Steppen-Hypothese liegt“, fasst das Team zusammen.",None,None,10.1126/science.abg0818,"['Paul Heggarty: Departamento de Humanidades, Pontificia Universidad Católica del Perú, 15088 Lima, Peru., Waves Group, Department of Human Behavior, Ecology and Culture, Max Planck Institute for Evolutionary Anthropology, 04103 Leipzig, Germany., Department of Linguistic and Cultural Evolution, Max Planck Institute for Evolutionary Anthropology, 04103 Leipzig, Germany.', 'Cormac Anderson: Department of Linguistic and Cultural Evolution, Max Planck Institute for Evolutionary Anthropology, 04103 Leipzig, Germany.', 'Matthew Scarborough: Department of Linguistic and Cultural Evolution, Max Planck Institute for Evolutionary Anthropology, 04103 Leipzig, Germany., Department of Nordic Studies and Linguistics, University of Copenhagen, S 2300 København, Denmark.', 'Benedict King: Department of Linguistic and Cultural Evolution, Max Planck Institute for Evolutionary Anthropology, 04103 Leipzig, Germany.', 'Remco Bouckaert: Centre for Computational Evolution, University of Auckland, Auckland 1010, New Zealand.', 'Lechosław Jocz: Faculty of Humanities, Jacob of Paradies University, 66-400 Gorzów Wielkopolski, Poland.', 'Martin Joachim Kümmel: Seminar for Indo-European Studies, Institut für Orientalistik, Indogermanistik, Ur- und Frühgeschichtliche Archäologie, Friedrich-Schiller-Universität Jena, 07743 Jena, Germany.', 'Thomas Jügel: Center for Religious Studies (CERES), Ruhr University Bochum, 44789 Bochum, Germany.', 'Britta Irslinger: Saxon Academy of Sciences and Humanities, 04107 Leipzig, Germany.', 'Roland Pooth: Department of Linguistics, Ghent University, 9000 Ghent, Belgium.', 'Henrik Liljegren: Department of Linguistics, Stockholm University, 10691 Stockholm, Sweden.', 'Richard F. Strand: Independent scholar, Cottonwood, AZ 86326, USA.', 'Geoffrey Haig: Department of General Linguistics, University of Bamberg, 96047 Bamberg, Germany.', 'Martin Macák: Independent scholar, 949 74 Nitra, Slovakia.', 'Ronald I. Kim: Department of Older Germanic Languages, Faculty of English, Adam Mickiewicz University in Poznań, 60-780 Poznań, Poland.', 'Erik Anonby: School of Linguistics and Language Studies, Carleton University, Ottawa, ON K1S 5B6, Canada., Leiden University Centre for Linguistics, 2300 RA Leiden, Netherlands.', 'Tijmen Pronk: Leiden University Centre for Linguistics, 2300 RA Leiden, Netherlands.', 'Oleg Belyaev: Department of Theoretical and Applied Linguistics, Lomonosov Moscow State University, 119991 GSP-1 Moscow, Russia., Department of Iranian Languages, Institute of Linguistics RAS, Moscow 125009, Russia.', 'Tonya Kim Dewey-Findell: Centre for the Study of the Viking Age, School of English, University of Nottingham NG7 2RD, UK.', 'Matthew Boutilier: Department of German, Nordic, and Slavic, University of Wisconsin–Madison, Madison, WI 53706, USA.', 'Cassandra Freiberg: Institut für deutsche Sprache und Linguistik, Sprach- und literaturwissenschaftliche Fakultät, Humboldt-Universität zu Berlin, 10099 Berlin, Germany.', 'Robert Tegethoff: Department of Linguistic and Cultural Evolution, Max Planck Institute for Evolutionary Anthropology, 04103 Leipzig, Germany., Seminar for Indo-European Studies, Institut für Orientalistik, Indogermanistik, Ur- und Frühgeschichtliche Archäologie, Friedrich-Schiller-Universität Jena, 07743 Jena, Germany.', 'Matilde Serangeli: Seminar for Indo-European Studies, Institut für Orientalistik, Indogermanistik, Ur- und Frühgeschichtliche Archäologie, Friedrich-Schiller-Universität Jena, 07743 Jena, Germany.', 'Nikos Liosis: Institute of Modern Greek Studies, Aristotle University of Thessaloniki, 54124 Thessaloniki, Greece.', 'Krzysztof Stroński: Faculty of Modern Languages, Adam Mickiewicz University in Poznań, 61-874 Poznań, Poland.', 'Kim Schulte: Department of Translation and Communication, Jaume I University, 12006 Castelló de la Plana, Spain.', 'Ganesh Kumar Gupta: Faculty of Modern Languages, Adam Mickiewicz University in Poznań, 61-874 Poznań, Poland.', 'Wolfgang Haak: Department of Archaeogenetics, Max Planck Institute for Evolutionary Anthropology, 04103 Leipzig, Germany.', 'Johannes Krause: Department of Archaeogenetics, Max Planck Institute for Evolutionary Anthropology, 04103 Leipzig, Germany.', 'Quentin D. Atkinson: School of Psychology, University of Auckland, Auckland 1010, New Zealand., Centre for the Study of Social Cohesion, University of Oxford, Oxford OX2 6PN, UK.', 'Simon J. Greenhill: Department of Linguistic and Cultural Evolution, Max Planck Institute for Evolutionary Anthropology, 04103 Leipzig, Germany., ARC Center of Excellence for the Dynamics of Language, ANU College of Asia and the Pacific, The Australian National University, Canberra, ACT 2600, Australia.', 'Denise Kühnert: Transmission, Infection, Diversification and Evolution Group, Max Planck Institute of Geoanthropology, 07745 Jena, Germany.', 'Russell D. Gray: Department of Linguistic and Cultural Evolution, Max Planck Institute for Evolutionary Anthropology, 04103 Leipzig, Germany., School of Psychology, University of Auckland, Auckland 1010, New Zealand.']",Science,"The origins of the Indo-European language family are hotly disputed. Bayesian phylogenetic analyses of core vocabulary have produced conflicting results, with some supporting a farming expansion out of Anatolia ~9000 years before present (yr B.P.), while others support a spread with horse-based pastoralism out of the Pontic-Caspian Steppe ~6000 yr B.P. Here we present an extensive database of Indo-European core vocabulary that eliminates past inconsistencies in cognate coding. Ancestry-enabled phylogenetic analysis of this dataset indicates that few ancient languages are direct ancestors of modern clades and produces a root age of ~8120 yr B.P. for the family. Although this date is not consistent with the Steppe hypothesis, it does not rule out an initial homeland south of the Caucasus, with a subsequent branch northward onto the steppe and then across Europe. We reconcile this hybrid hypothesis with recently published ancient DNA evidence from the steppe and the northern Fertile Crescent.",0.6685093,24,0
history-archaeology,Den Bewohnern Machu Picchus auf der Spur,"Wer wohnte in der berühmten Inka-Stadt in den peruanischen Anden? Eine genetische Untersuchung von in Machu Picchu begrabenen Menschen belegt nun: In dem nur zeitweise genutzten Herrschersitz lebte dauerhaft eine „bunt zusammengewürfelte“ Gemeinschaft aus Bediensteten. Sie waren aus teils erstaunlich weit entfernten Regionen des Inka-Imperiums an den entlegenen Ort gebracht worden, geht aus den genetischen Vergleichen hervor.","Wer wohnte in der berühmten Inka-Stadt in den peruanischen Anden? Eine genetische Untersuchung von in Machu Picchu begrabenen Menschen belegt nun: In dem nur zeitweise genutzten Herrschersitz lebte dauerhaft eine „bunt zusammengewürfelte“ Gemeinschaft aus Bediensteten. Sie waren aus teils erstaunlich weit entfernten Regionen des Inka-Imperiums an den entlegenen Ort gebracht worden, geht aus den genetischen Vergleichen hervor.

Hoch in den peruanischen Anden thront auf einem Berggrat eines der berühmtesten Baudenkmäler der Menschheit: Machu Picchu ist ein faszinierendes Zeugnis der Hochkultur der Inka. Die monumentalen Siedlungsstrukturen konnten Schätzungen zufolge bis zu 750 Menschen beherbergen. Lange blieb unklar, aus welcher Zeit der spektakuläre Komplex stammt und welchem Zweck er gedient hat. Mittlerweile sind sich Archäologen und Historiker aber weitgehend darüber einig, dass es sich um ein royales Anwesen gehandelt hat, das um 1420 n. Chr. erbaut worden war. Demnach kamen die Inkaherrscher und ihr Hofstaat aus der nahegelegen Hauptstadt Cusco hierher, um zeitweise in den Andenhöhen zu residieren.
Auf dem Gelände wurden auch zahlreiche Gräber aus der Zeit zwischen 1420 und 1532 entdeckt, die aber nicht der edlen Gesellschaft zuzuordnen sind. Man nimmt an, dass diese Toten die eigentlichen Einwohner von Machu Picchu waren. Es handelte sich demnach um die Bedienstete, die sich um die royalen Besucher kümmerten, die Anlage aber auch dauerhaft bewohnten und pflegten. Aus Überlieferungen ist bekannt, dass die Männer dieser Gruppe „Yanacona“ und die Frauen „Aclla“ genannt wurden.
Um mehr über diese Menschen zu erfahren, hat ein internationales Forscherteam nun DNA aus Zähnen von 34 auf dem Areal von Machu Picchu begrabenen Menschen gewonnen und sequenziert. „Es ging uns in diesem Fall also nicht um Informationen zu den Eliten und Herrschern, sondern um Menschen mit niedrigerem Status“, sagt Co-Autor Jason Nesbitt von der Tulane University in New Orleans. Zum Vergleich dienten den Wissenschaftlern Genome aus menschlichen Überresten, die von Inka-Begräbnisstätten im nahe gelegenen Urubamba-Tal sowie aus der einstigen Hauptstadt Cusco stammten. Außerdem konnten sie die genetischen Daten mit weiteren Referenzgenomen aus verschiedenen Bereichen Südamerikas vergleichen.
Wie die Forscher berichten, ging aus den Studienergebnissen eindeutig hervor, dass die in Machu Picchu begrabenen Menschen nicht aus der umliegenden Region stammten. Ihren genetischen Profilen zufolge liegen ihre Ursprünge in vielen unterschiedlichen Bereichen des einstigen Machtbereichs der Inka. Einige waren offenbar sogar aus dem Amazonasgebiet in den Residenz-Komplex in den peruanischen Anden gelangt. Nur wenige von ihnen wiesen genetische Gemeinsamkeiten auf, was belegt, dass sie als Einzelpersonen und nicht als Teil einer Familie oder Gruppe nach Machu Picchu gebracht worden waren. Später vermischten sich die Menschen aber offenbar auch und erzeugten eine genetisch sehr vielfältige Population. „Die Ergebnisse belegen eine sehr bunte Gemeinschaft aus Bediensteten in Machu Picchu, in der Menschen mit unterschiedlichem genetischen Hintergrund zusammen lebten, sich fortpflanzten und gemeinsam bestattet wurden“ resümieren die Forscher.
Die Ergebnisse passen ihren zufolge auch zu historischen Hinweisen über die „Yanacona“ und „Aclla“ – die Bediensteten der royalen Eliten. Es handelte sich demnach um Menschen, die von den Inka aus eroberten Gebieten mitgenommen wurden oder als „Geschenke“ überbracht worden waren. Sie wurden zwar verschleppt, doch den Überlieferungen und archäologischen Befunden zufolge behandelte man diese Personen im Umfeld des Herrscherhauses anschließend vergleichsweise gut und sie galten als privilegiert.
Das enorme Ausmaß der Diversität dieser Gruppe in Machu Picchu überraschte die Forscher allerdings. „Besonders unerwartet war die Feststellung, dass einige dieser Personen sogar amazonischen Ursprungs waren“, hebt Erst-Autorin Lucy Salazar von der Yale University hervor. Dazu schreibt das Team abschließend: „Die starke Präsenz von Individuen, insbesondere von Frauen, aus mehreren Zonen der bewaldeten östlichen Andenhänge und des Amazonas-Tieflandes verweist auf die Notwendigkeit weiterer Untersuchungen zur Rolle dieser Regionen für das Inkareich“.",None,None,10.1126/sciadv.adg3377,"['Lucy Salazar: Department of Anthropology, Yale University, New Haven, CT 06511-3707, USA., Department of Archaeology, Universidad Nacional de San Antonio Abad del Cusco, Cusco 08006, Peru.', 'Richard Burger: Department of Anthropology, Yale University, New Haven, CT 06511-3707, USA.', 'Janine Forst: UCSC Paleogenomics Lab, Department of Anthropology, University of California Santa Cruz, Santa Cruz, CA 95064, USA.', 'Rodrigo Barquera: Department of Archaeogenetics, Max Planck Institute for Evolutionary Anthropology, Leipzig, 04103, Germany.', 'Jason Nesbitt: Department of Anthropology, Tulane University, New Orleans, LA 70118, USA.', 'Jorge Calero: Department of Archaeology, Universidad Nacional de San Antonio Abad del Cusco, Cusco 08006, Peru.', 'Eden Washburn: UCSC Paleogenomics Lab, Department of Anthropology, University of California Santa Cruz, Santa Cruz, CA 95064, USA.', 'John Verano: Department of Anthropology, Tulane University, New Orleans, LA 70118, USA.', 'Kimberly Zhu: Department of Anthropology, University of California, Los Angeles, Los Angeles, CA 90095, USA.', 'Korey Sop: UCSC Paleogenomics Lab, Department of Anthropology, University of California Santa Cruz, Santa Cruz, CA 95064, USA.', 'Kalina Kassadjikova: UCSC Paleogenomics Lab, Department of Anthropology, University of California Santa Cruz, Santa Cruz, CA 95064, USA.', 'Bebel Ibarra Asencios: Department of Anthropology, Tulane University, New Orleans, LA 70118, USA., Department of Archaeology, Universidad Nacional Santiago Antúnez de Mayolo, Huaraz 02002, Peru.', 'Roberta Davidson: Australian Centre for Ancient DNA, School of Biological Sciences and The Environment Institute, Adelaide University, Adelaide, SA 5005, Australia.', 'Brenda Bradley: Department of Anthropology, Center for the Advanced Study of Human Paleobiology, The George Washington University, Washington, DC 20052, USA.', 'Johannes Krause: Department of Archaeogenetics, Max Planck Institute for Evolutionary Anthropology, Leipzig, 04103, Germany.', 'Lars Fehren-Schmitz: UCSC Paleogenomics Lab, Department of Anthropology, University of California Santa Cruz, Santa Cruz, CA 95064, USA., UCSC Genomics Institute, University of California, Santa Cruz, Santa Cruz, CA 95060, USA.']",Science Advances,"Machu Picchu originally functioned as a palace within the estate of the Inca emperor Pachacuti between ~1420 and 1532 CE. Before this study, little was known about the people who lived and died there, where they came from or how they were related to the inhabitants of the Inca capital of Cusco. We generated genome-wide data for 34 individuals buried at Machu Picchu who are believed to have been retainers or attendants assigned to serve the Inca royal family, as well as 34 individuals from Cusco for comparative purposes. When the ancient DNA results are contextualized using historical and archaeological data, we conclude that the retainer population at Machu Picchu was highly heterogeneous with individuals exhibiting genetic ancestries associated with groups from throughout the Inca Empire and Amazonia. The results suggest a diverse retainer community at Machu Picchu in which people of different genetic backgrounds lived, reproduced, and were interred together.",0.70079064,25,0
