pls,fk_score,ari_score,reference,abstract
"
Babies and toddlers exposed to television or video viewing may be more likely to exhibit atypical sensory behaviors, such as being disengaged and disinterested in activities, seeking more intense stimulation in an environment, or being overwhelmed by sensations like loud sounds or bright lights, according to data from researchers at Drexel's College of Medicine published today in the journal JAMA Pediatrics.

According to the researchers, children exposed to greater TV viewing by their second birthday were more likely to develop atypical sensory processing behaviors, such as ""sensation seeking"" and ""sensation avoiding,"" as well as ""low registration"" -- being less sensitive or slower to respond to stimuli, such as their name being called, by 33 months old.
Sensory processing skills reflect the body's ability to respond efficiently and appropriately to information and stimuli received by its sensory systems, such as what the toddler hears, sees, touches, and tastes.
The team pulled 2011-2014 data on television or DVD-watching by babies and toddlers at 12- 18- and 24-months from the National Children's Study of 1,471 children (50% male) nationwide.
Sensory processing outcomes were assessed at 33 months using the Infant/Toddler Sensory Profile (ITSP), a questionnaire completed by parents/caregivers, designed to give insights on how children process what they see, hear and smell, etc.
ITSP subscales examine children's patterns of low registration, sensation seeking, such as excessively touching or smelling objects; sensory sensitivity, such as being overly upset or irritated by lights and noise; and sensation avoiding -- actively trying to control their environment to avoid things like having their teeth brushed. Children score in ""typical,"" ""high"" or ""low"" groups based on how often they display various sensory-related behaviors. Scores were considered ""typical"" if they were within one standard deviation from the average of the ITSP norm.
Measurements of screen exposure at 12-months were based on caregiver responses to the question: ""Does your child watch TV and/or DVDs? (yes/no),"" and at 18- and 24- months based on the question: ""Over the past 30 days, on average, how many hours per day did your child watch TV and/or DVDs?""
The findings suggest: At 12 months, any screen exposure compared to no screen viewing was associated with a 105% greater likelihood of exhibiting ""high"" sensory behaviors instead of ""typical"" sensory behaviors related to low registration at 33 months At 18 months, each additional hour of daily screen time was associated with 23% increased odds of exhibiting ""high"" sensory behaviors related to later sensation avoiding and low registration. At 24 months, each additional hour of daily screen time was associated with a 20% increased odds of ""high"" sensation seeking, sensory sensitivity, and sensation avoiding at 33 months.

The researchers adjusted for age, whether the child was born prematurely, caregiver education, race/ethnicity and other factors, such as how often the child engages in play or walks with the caregiver.
The findings add to a growing list of concerning health and developmental outcomes linked to screen time in infants and toddlers, including language delay, autism spectrum disorder, behavioral issues, sleep struggles, attention problems and problem-solving delays.
""This association could have important implications for attention deficit hyperactivity disorder and autism, as atypical sensory processing is much more prevalent in these populations,"" said lead author Karen Heffler, MD, an associate professor of Psychiatry in Drexel's College of Medicine. ""Repetitive behavior, such as that seen in autism spectrum disorder, is highly correlated with atypical sensory processing. Future work may determine whether early life screen time could fuel the sensory brain hyperconnectivity seen in autism spectrum disorders, such as heightened brain responses to sensory stimulation.""
Atypical sensory processing in kids with autism spectrum disorder (ASD) and ADHD manifests in a range of detrimental behaviors. In children with ASD, greater sensation seeking or sensation avoiding, heightened sensory sensitivity and low registration have been associated with irritability, hyperactivity, eating and sleeping struggles, as well as social problems. In kids with ADHD, atypical sensory processing is linked to trouble with executive function, anxiety and lower quality of life.
""Considering this link between high screen time and a growing list of developmental and behavioral problems, it may be beneficial for toddlers exhibiting these symptoms to undergo a period of screen time reduction, along with sensory processing practices delivered by occupational therapists,"" said Heffler.
The American Academy of Pediatrics (AAP) discourages screen time for babies under 18-24 months. Live video chat is considered by the AAP to be okay, as there may be benefit from the interaction that takes place. AAP recommends time limitations on digital media use for children 2 to 5 years to typically no more than 1 hour per day.

""Parent training and education are key to minimizing, or hopefully even avoiding, screen time in children younger than two years,"" said senior author David Bennett, PhD, a professor of Psychiatry in Drexel's College of Medicine.""
Despite the evidence, many toddlers view screens more often. As of 2014, children age 2 and under in the United States averaged 3 hours, 3 minutes a day of screen time, up from 1 hour, 19 minutes a day in 1997, according to a 2019 research letter in JAMA Pediatrics. Some parents cite exhaustion and inability for affordable alternatives as reasons for the screen time, according to a July 2015 study in the Journal of Nutrition and Behavior.
Although the current paper looked strictly at television or DVD watching, and not media viewed on smartphones or tablets, it does provide some of the earliest data linking early-life digital media exposure with later atypical sensory processing across multiple behaviors. The authors said future research is needed to better understand the mechanisms that drive the association between early-life screen time and atypical sensory processing.
In addition to Heffler and Bennett, authors on this paper include Binod Acharya, who completed the work while at Drexel's Dornsife School of Public Health's Urban Health Collaborative, and Keshab Subedi from Christiana Care Health Systems. 

","score: 17.82107642728508, grade_level: '18'","score: 19.681052415405517, grade_levels: ['college_graduate'], ages: [24, 100]",10.1001/jamapediatrics.2023.5923,"Atypical sensory processing is challenging for children and families, yet there is limited understanding of its associated risk factors. To determine the association between early-life digital media exposure and sensory processing outcomes among toddlers. This multicenter US study used data that were analyzed from the National Children’s Study (NCS), a cohort study of environmental influences on child health and development, with enrollment from 2011 to 2014. Data analysis was performed in 2023. The study included children enrolled in the NCS at birth whose caregivers completed reports of digital media exposure and sensory processing. Children’s viewing of television or video at 12 months (yes or no), 18 months, and 24 months of age (hours per day). Sensory processing was reported at approximately 33 months of age on the Infant/Toddler Sensory Profile. Quadrant scores (low registration, sensation seeking, sensory sensitivity, and sensation avoiding) were categorized into groups representing typical, high, and low sensory-related behaviors, and multinomial regression analyses were performed. A total of 1471 children (50% male) were included. Screen exposure at 12 months of age was associated with a 2-fold increased odds of being in the high category of low registration (odds ratio [OR], 2.05; 95% CI, 1.31-3.20), while the odds of being in the low category instead of the typical category decreased for sensation seeking (OR, 0.55; 95% CI, 0.35-0.87), sensation avoiding (OR, 0.69; 95% CI, 0.50-0.94), and low registration (OR, 0.64; 95% CI, 0.44-0.92). At 18 months of age, greater screen exposure was associated with increased risk of high sensation avoiding (OR, 1.23; 95% CI, 1.03-1.46) and low registration (OR, 1.23; 95% CI, 1.04-1.44). At 24 months of age, greater screen exposure was associated with increased risk of high sensation seeking (OR, 1.20; 95% CI, 1.02-1.42), sensory sensitivity (OR, 1.25; 95% CI, 1.05-1.49), and sensation avoiding (OR, 1.21; 95% CI, 1.03-1.42). In this cohort study, early-life digital media exposure was associated with atypical sensory processing outcomes in multiple domains. These findings suggest that digital media exposure might be a potential risk factor for the development of atypical sensory profiles. Further research is needed to understand the relationship between screen time and specific sensory-related developmental and behavioral outcomes, and whether minimizing early-life exposure can improve subsequent sensory-related outcomes."
"
For children, the world is full of surprises. Adults, on the other hand, are much more difficult to surprise. And there are complex processes behind this apparently straightforward state of affairs. Researchers at the University of Basel have been using mice to decode how reactions to the unexpected develop in the growing brain.

Babies love playing peekaboo, continuing to react even on the tenth sudden appearance of their partner in the game. Recognizing the unexpected is an important cognitive ability. After all, new can also mean dangerous.
The exact way in which surprises are processed in the brain changes as we grow, however: unusual stimuli are much more quickly categorized as ""important"" or ""uninteresting,"" and are significantly less surprising the second and third time they appear. This increased efficiency makes perfect sense: new stimuli may gain our attention, but do not cause an unnecessarily strong reaction that costs us energy. While this may appear trivial at first, so far there has been very little research into this fact in the context of brain development.
Experiments with young mice conducted by Professor Tania Barkat's research team have now begun to decode how the developing brain processes surprising sounds and what changes as we grow up. The researchers have reported on their findings in the journal Science Advances.
Strange sounds
In their experiments, the researchers used sequences of sounds in which a different tone was heard at irregular intervals in between a series of identical ones. At the same time, they recorded the animals' brain waves. This process is known as the ""oddball paradigm,"" and is used by health professionals for purposes such as the diagnosis of schizophrenia.
Using these measurements, the researchers were able to understand how the reaction of different brain regions to the change of tone developed over time in the young mice. This reaction was initially very strong, but decreased as the relevant brain region matured, to a level comparable to that of measurements in adult animals. This development does not take place simultaneously in the various areas of the brain that process sound, however.

A region known as the inferior colliculus, located at the beginning of the path from the auditory nerve to the auditory cortex, was already fully mature in the animals at the age of 20 days, the earliest point in time studied by the team. A second site, the auditory thalamus, only showed an ""adult"" reaction to the differing tone at the age of 30 days.
Development in the cerebral cortex itself, the ""primary auditory cortex,"" took even longer, until day 50. ""This development of the surprise reaction thus begins in the periphery and ends in the cerebral cortex,"" says study leader Tania Barkat. The cerebral cortex therefore matures much later than expected -- in human years, this would equate roughly to the early 20s.
No development without experience
The researchers also observed that experiences play a key role in the development of the surprise response in the cerebral cortex. If the mice were reared in a noise-neutral environment, the processing of unexpected sounds in the auditory cortex was significantly delayed.
One possible explanation for this is that the brain -- and the cerebral cortex in particular -- forms an internal image of the world during growth, which it then compares with external stimuli. Anything that does not correspond to this ""worldview"" is a surprise, but may also result in an update. ""Without experience with sounds, however, the cerebral cortex in these mice is unable to develop such a model of the world,"" says neuroscientist Barkat. As a result, the animal is unable to categorize sounds properly into ""familiar"" and ""unexpected.""

","score: 12.347769672855879, grade_level: '12'","score: 12.554053381962866, grade_levels: ['college'], ages: [18, 24]",10.1126/sciadv.adi7624,"Stimulus-specific adaptation (SSA), the reduction of neural activity to a common stimulus that does not generalize to other, rare stimuli, is an essential property of our brain. Although well characterized in adults, it is still unknown how it develops during adolescence and what neuronal circuits are involved. Using in vivo electrophysiology and optogenetics in the lemniscal pathway of the mouse auditory system, we observed SSA to be stable from postnatal day 20 (P20) in the inferior colliculus, to develop until P30 in the auditory thalamus and even later in the primary auditory cortex (A1). We found this maturation process to be experience-dependent in A1 but not in thalamus and to be related to alterations in deep but not input layers of A1. We also identified corticothalamic projections to be implicated in thalamic SSA development. Together, our results reveal different circuits underlying the sequential SSA maturation and provide a unique perspective to understand predictive coding and surprise across sensory systems."
"
A UC Riverside study to motivate your new year's resolutions: it demonstrates that high-fat diets affect genes linked not only to obesity, colon cancer and irritable bowels, but also to the immune system, brain function, and potentially COVID-19 risk.

While other studies have examined the effects of a high-fat diet, this one is unusual in its scope. UCR researchers fed mice three different diets over the course of 24 weeks where at least 40% of the calories came from fat. Then, they looked not only at the microbiome, but also at genetic changes in all four parts of the intestines.
One group of mice ate a diet based on saturated fat from coconut oil, another got a monounsaturated, modified soybean oil, a third got an unmodified soybean oil high in polyunsaturated fat. Compared to a low-fat control diet, all three groups experienced concerning changes in gene expression, the process that turns genetic information into a functional product, such as a protein.
""Word on the street is that plant-based diets are better for you, and in many cases that's true. However, a diet high in fat, even from a plant, is one case where it's just not true,"" said Frances Sladek, a UCR cell biology professor and senior author of the new study.
A new Scientific Reports paper about the study documents the many impacts of high-fat diets. Some of the intestinal changes did not surprise the researchers, such as major changes in genes related to fat metabolism and the composition of gut bacteria. For example, they observed an increase in pathogenic E. coli and a suppression of Bacteroides, which helps protect the body against pathogens.
Other observations were more surprising, such as changes in genes regulating susceptibility to infectious diseases. ""We saw pattern recognition genes, ones that recognize infectious bacteria, take a hit. We saw cytokine signaling genes take a hit, which help the body control inflammation,"" Sladek said. 'So, it's a double whammy. These diets impair immune system genes in the host, and they also create an environment in which harmful gut bacteria can thrive.""
The team's previous work with soybean oil documents its link to obesity and diabetes, both major risk factors for COVID. This paper now shows that all three high-fat diets increase the expression of ACE2 and other host proteins that are used by COVID spike proteins to enter the body.

Additionally, the team observed that high-fat food increased signs of stem cells in the colon. ""You'd think that would be a good thing, but actually they can be precursors to cancer,"" Sladek said.
In terms of effects on gene expression, coconut oil showed the greatest number of changes, followed by the unmodified soybean oil. Differences between the two soybean oils suggest that polyunsaturated fatty acids in unmodified soybean oil, primarily linoleic acid, play a role in altering gene expression.
Negative changes to the microbiome in this study were more pronounced in mice fed the soybean oil diet. This was unsurprising, as the same research team previously documented other negative health effects of high soybean oil consumption.
In 2015, the team found that soybean oil induces obesity, diabetes, insulin resistance, and fatty liver in mice. In 2020, the researchers team demonstrated the oil could also affect genes in the brain related to conditions like autism, Alzheimer's disease, anxiety, and depression.
Interestingly, in their current work they also found the expression of several neurotransmitter genes were changed by the high fat diets, reinforcing the notion of a gut-brain axis that can be impacted by diet.
The researchers have noted that these findings only apply to soybean oil, and not to other soy products, tofu, or soybeans themselves. ""There are some really good things about soybeans. But too much of that oil is just not good for you,"" said UCR microbiologist Poonamjot Deol, who was co-first author of the current study along with UCR postdoctoral researcher Jose Martinez-Lomeli.

Also, the studies were conducted using mice, and mouse studies do not always translate to the same results in humans. However, humans and mice share 97.5% of their working DNA. Therefore, the findings are concerning, as soybean oil is the most commonly consumed oil in the United States, and is increasingly being used in other countries, including Brazil, China, and India.
By some estimates, Americans tend to get nearly 40% of their calories from fat, which mirrors what the mice were fed in this study. ""Some fat is necessary in the diet, perhaps 10 to 15%. Most people though, at least in this country, are getting at least three times the amount that they need,"" Deol said.
Readers should not panic about a single meal. It is the long-term high-fat habit that caused the observed changes. Recall that the mice were fed these diets for 24 weeks. ""In human terms, that is like starting from childhood and continuing until middle age. One night of indulgence is not what these mice ate. It's more like a lifetime of the food,"" Deol said.
That said, the researchers hope the study will cause people to closely examine their eating habits.
""Some people think, 'Oh, I'll just exercise more and be okay. But regularly eating this way could be impacting your immune system and how your brain functions,"" Deol said. ""You may not be able to just exercise away these effects.""

","score: 10.37580477972934, grade_level: '10'","score: 11.068455226029371, grade_levels: ['12'], ages: [17, 18]",10.1038/s41598-023-49555-7,"High fat diets (HFDs) have been linked to several diseases including obesity, diabetes, fatty liver, inflammatory bowel disease (IBD) and colon cancer. In this study, we examined the impact on intestinal gene expression of three isocaloric HFDs that differed only in their fatty acid composition—coconut oil (saturated fats), conventional soybean oil (polyunsaturated fats) and a genetically modified soybean oil (monounsaturated fats). Four functionally distinct segments of the mouse intestinal tract were analyzed using RNA-seq—duodenum, jejunum, terminal ileum and proximal colon. We found considerable dysregulation of genes in multiple tissues with the different diets, including those encoding nuclear receptors and genes involved in xenobiotic and drug metabolism, epithelial barrier function, IBD and colon cancer as well as genes associated with the microbiome and COVID-19. Network analysis shows that genes involved in metabolism tend to be upregulated by the HFDs while genes related to the immune system are downregulated; neurotransmitter signaling was also dysregulated by the HFDs. Genomic sequencing also revealed a microbiome altered by the HFDs. This study highlights the potential impact of different HFDs on gut health with implications for the organism as a whole and will serve as a reference for gene expression along the length of the intestines."
