pls,fk_score,ari_score,reference,abstract
"
Practicing yoga nidra -- a kind of mindfulness training -- might improve sleep, cognition, learning, and memory, even in novices, according to a pilot study publishing in the open-access journal PLOS ONE on December 13 by Karuna Datta of the Armed Forces Medical College in India, and colleagues. After a two-week intervention with a cohort of novice practitioners, the researchers found that the percentage of delta-waves in deep sleep increased and that all tested cognitive abilities improved.

Unlike more active forms of yoga, which focus on physical postures, breathing, and muscle control, yoga nidra guides people into a state of conscious relaxation while they are lying down. While it has reported to improve sleep and cognitive ability, those reports were based more on subjective measures than on objective data. The new study used objective polysomnographic measures of sleep and a battery of cognitive tests. Measurements were taken before and after two weeks of yoga nidra practice, which was carried out during the daytime using a 20 minute audio recording.
Among other things, polysomnography measures brain activity to determine how long each sleep stage lasts and how frequently each stage occurs. After two weeks of yoga nidra, the researchers observed that participants exhibited a significantly increased sleep efficiency and percentage of delta-waves in deep sleep. They also saw faster responses in all cognitive tests with no loss in accuracy and faster and more accurate responses in tasks including tests of working memory, abstraction, fear and anger recognition, and spatial learning and memory tasks. The findings support previous studies which link delta-wave sleep to improved sleep quality as well as better attention and memory.
The authors believe their study provides objective evidence that yoga nidra is an effective means of improving sleep quality and cognitive performance. Yoga nidra is a low-cost and highly accessible activity from which many people might therefore benefit.
The authors add: ""Yoga nidra practice improves sleep and makes brain processing faster. Accuracy also increased, especially with learning and memory related tasks.""

","score: 14.957880737880739, grade_level: '15'","score: 16.09204633204633, grade_levels: ['college_graduate'], ages: [24, 100]",10.1371/journal.pone.0294678,"Complementary and Alternative medicine is known to have health benefits. Yoga nidra practice is an easy-to-do practice and has shown beneficial effects on stress reduction and is found to improve sleep in insomnia patients. Effect of yoga nidra practice on subjective sleep is known but its effect on sleep and cognition objectively is not documented. The aim of the study was to study the effect of yoga nidra practice on cognition and sleep using objective parameters. 41 participants were enrolled, and baseline sleep diary (SD) collected. Participants volunteered for overnight polysomnography (PSG) and cognition testing battery (CTB) comprising of Motor praxis test, emotion recognition task (ERT), digital symbol substitution task, visual object learning task (VOLT), abstract matching (AIM), line orientation task, matrix reasoning task, fractal-2-back test (NBACK), psychomotor vigilance task and balloon analog risk task. Baseline CTB and after one and two weeks of practice was compared. Power spectra density for EEG at central, frontal, and occipital locations during CTB was compared. Repeat SD and PSG after four weeks of practice were done. After yoga nidra practice, improved reaction times for all cognition tasks were seen. Post intervention compared to baseline (95%CI; p-value, effect size) showed a significant improvement in sleep efficiency of +3.62% (0.3, 5.15; p = 0.03, r = 0.42), -20min (-35.78, -5.02; p = 0.003, d = 0.84) for wake after sleep onset and +4.19 μV2 (0.5, 9.5; p = 0.04, r = 0.43) in delta during deep sleep. Accuracy increased in VOLT (95% CI: 0.08, 0.17; p = 0.002, d = 0.79), AIM (95% CI: 0.03, 0.12; p = 0.02, d = 0.61) and NBACK (95% CI: 0.02, 0.13; p = 0.04, d = 0.56); ERT accuracy increased for happy, fear and anger (95% CI: 0.07, 0.24; p = 0.004, d = 0.75) but reduced for neutral stimuli (95% CI: -0.31, -0.12; p = 0.04, r = 0.33) after yoga nidra practice. Yoga Nidra practice improved cognitive processing and night-time sleep."
"
New research from Binghamton University, State University of New York shows how some workplace gossip could reduce the likelihood of employee turnover and, as a result, potentially boost an organization's effectiveness.

""Organizations should be aware of the impact of positive gossip because turnover can be a very important factor in dictating an organization's success,"" said Jinhee Moon, a doctoral student at the Binghamton University School of Management who conducted the study with a team of other researchers. ""To make employees participate in positive gossip, the organization should do the right things by treating their employees well, and being aware their behaviors can show they care about their employees.""
While studies linked to workplace gossip aren't new, Moon's work builds upon previous research by exploring how employees who gossip might experience social gains. Moon previously worked on a study that dealt with why people participate in gossipy behavior at their workplace, and the recent publication is connected to her own leadership research focus at SOM, which centers on interpersonal relationships and social networks.
For the recent study, Moon and fellow researchers surveyed 338 health workers in South Korea on positive and negative forms of workplace gossip related to their organizations and management. Some of the topics included: ""At work, I sometimes complain about my organization when management is absent."" ""If I feel treated badly by management, I talk about this to my colleagues."" ""I sometimes praise my organization's capability when the management is absent.""Moon said the research showed gossip is viewed as more valuable when people positively talk about their management or organization. Health workers who participated in the survey expressed more interest in information they could use to enhance or maintain their organizational status.
The study also indicated no relationship between negative gossip and coercive power in the workplace, which Moon said proved contrary to what researchers had expected.
""We expected that if you participate in negative gossip, maybe you're trying to appear powerful or controlling or want to 'beat someone up,' but we couldn't find any supportive results,"" Moon said. ""If anything, we found that people didn't value that type of gossip as information and just saw it as someone who wants to complain. So, if you're thinking about negative workplace gossip, you might want to save your time because there's no positive impact for you.""
But one of the most helpful aspects of the research, as Moon saw it, was how it highlighted that participating in positive gossip among one's coworkers could reduce the chances of voluntary employee turnover.
""It can be very hard just to quit your job, and if you're experiencing difficulty where you work, maybe you want to participate in positive gossip with your colleagues and talk about some of the more bearable aspects of the organization,"" Moon said. ""Eventually, that can help you gain some personal power. It's a very convenient way to reduce negative feelings toward your own workplace, which can help you more in the long run.""

","score: 15.007120622568095, grade_level: '15'","score: 16.113650419823877, grade_levels: ['college_graduate'], ages: [24, 100]",10.1177/10596011231203758,"Although workplace gossip is ubiquitous, more scholarship is needed to determine how employees may use gossip to attain valuable social resources at work—namely, their experience of power. Drawing from the gossip literature and research on power in the workplace, we identify proximal (i.e., increased power accrual) and distal (i.e., diminished voluntary turnover) positive outcomes for employees enacting negative and positive gossip about the organization at work. Using a sample of 338 nurses, we found that positive workplace gossip about the organization increases expert power. Our analysis further revealed that positive workplace gossip about the organization had a negative indirect effect on the voluntary turnover of gossip actors via their expert power. Our findings contribute to the organizational literature on the benefits of gossip to actors and serve to further enrich the emerging literature which has considered the relationship between power and turnover. An important implication of our research is that organizations need to recognize the dynamics of organization-directed gossip and its potential to serve as a source of social power for employees and a retention driver for those who accrue power in expertise."
"
A Cambridge-led study has shown why many women experience nausea and vomiting during pregnancy -- and why some women, including the Duchess of Cambridge, become so sick they need to be admitted to hospital.

The culprit is a hormone produced by the fetus -- a protein known as GDF15. But how sick the mother feels depends on a combination of how much of the hormone is produced by the fetus and how much exposure the mother had to this hormone before becoming pregnant.
The discovery, published today in Nature, points to a potential way to prevent pregnancy sickness by exposing mothers to GDF15 ahead of pregnancy to build up their resilience.
As many as seven in ten pregnancies are affected by nausea and vomiting. In some women -- thought to be between one and three in 100 pregnancies -- it can be severe, even threatening the life of the fetus and the mother and requiring intravenous fluid replacement to prevent dangerous levels of dehydration. So-called hyperemesis gravidarum is the commonest cause of admission to hospital of women in the first three months of pregnancy.
Although some therapies exist to treat pregnancy sickness and are at least partially effective, widespread ignorance of the disorder compounded by fear of using medication in pregnancy mean that many women with this condition are inadequately treated.
Until recently, the cause of pregnancy sickness was entirely unknown. Recently, some evidence, from biochemical and genetic studies has suggested that it might relate to the production by the placenta of the hormone GDF15, which acts on the mother's brain to cause her to feel nauseous and vomit.
Now, an international study, involving scientists at the University of Cambridge and researchers in Scotland, the USA and Sri Lanka, has made a major advance in understanding the role of GDF15 in pregnancy sickness, including hyperemesis gravidarum.

The team studied data from women recruited to a number of studies, including at the Rosie Maternity Hospital, part of Cambridge University Hospitals NHS Foundation Trust and Peterborough City Hospital, North West Anglia NHS Foundation Trust. They used a combination of approaches including human genetics, new ways of measuring hormones in pregnant women's blood, and studies in cells and mice.
The researchers showed that the degree of nausea and vomiting that a woman experiences in pregnancy is directly related to both the amount of GDF15 made by the fetal part of placenta and sent into her bloodstream, and how sensitive she is to the nauseating effect of this hormone.
GDF15 is made at low levels in all tissues outside of pregnancy. How sensitive the mother is to the hormone during pregnancy is influenced by how much of it she was exposed to prior to pregnancy -- women with normally low levels of GDF15 in blood have a higher risk of developing severe nausea and vomiting in pregnancy.
The team found that a rare genetic variant that puts women at a much greater risk of hyperemesis gravidarum was associated with lower levels of the hormone in the blood and tissues outside of pregnancy. Similarly, women with the inherited blood disorder beta thalassemia, which causes them to have naturally very high levels of GDF15 prior to pregnancy, experience little or no nausea or vomiting.
Professor Sir Stephen O'Rahilly, Co-Director of the Wellcome-Medical Research Council Institute of Metabolic Science at the University of Cambridge, who led the collaboration, said: ""Most women who become pregnant will experience nausea and sickness at some point, and while this is not pleasant, for some women it can be much worse -- they'll become so sick they require treatment and even hospitalisation.
""We now know why: the baby growing in the womb is producing a hormone at levels the mother is not used to. The more sensitive she is to this hormone, the sicker she will become. Knowing this gives us a clue as to how we might prevent this from happening. It also makes us more confident that preventing GDF15 from accessing its highly specific receptor in the mother's brain will ultimately form the basis for an effective and safe way of treating this disorder.""
Mice exposed to acute, high levels of GDF15 showed signs of loss of appetite, suggesting that they were experiencing nausea, but mice treated with a long-acting form of GDF15 did not show similar behaviour when exposed to acute levels of the hormone. The researchers believe that building up woman's tolerance to the hormone prior to pregnancy could hold the key to preventing sickness.

Co-author Dr Marlena Fejzo from the Department of Population and Public Health Sciences at the University of Southern California whose team had previously identified the genetic association between GDF15 and hyperemesis gravidarum, has first-hand experience with the condition. ""When I was pregnant, I became so ill that I could barely move without being sick. When I tried to find out why, I realized how little was known about my condition, despite pregnancy nausea being very common.
""Hopefully, now that we understand the cause of hyperemesis gravidarum, we're a step closer to developing effective treatments to stop other mothers going through what I and many other women have experienced.""
The work involved collaboration between scientists at the University of Cambridge, University of Southern California, University of Edinburgh, University of Glasgow and Kelaniya University, Colombo, Sri Lanka. The principal UK funders of the study were the Medical Research Council and Wellcome, with support from the National Institute for Health and Care Research Cambridge Biomedical Research Centre.

","score: 15.910759095516024, grade_level: '16'","score: 17.114258204312726, grade_levels: ['college_graduate'], ages: [24, 100]",10.1038/s41586-023-06921-9,"GDF15, a hormone acting on the brainstem, has been implicated in the nausea and vomiting of pregnancy, including its most severe form, hyperemesis gravidarum (HG), but a full mechanistic understanding is lacking1–4. Here we report that fetal production of GDF15 and maternal sensitivity to it both contribute substantially to the risk of HG. We confirmed that higher GDF15 levels in maternal blood are associated with vomiting in pregnancy and HG. Using mass spectrometry to detect a naturally labelled GDF15 variant, we demonstrate that the vast majority of GDF15 in the maternal plasma is derived from the feto-placental unit. By studying carriers of rare and common genetic variants, we found that low levels of GDF15 in the non-pregnant state increase the risk of developing HG. Conversely, women with β-thalassaemia, a condition in which GDF15 levels are chronically high5, report very low levels of nausea and vomiting of pregnancy. In mice, the acute food intake response to a bolus of GDF15 is influenced bi-directionally by prior levels of circulating GDF15 in a manner suggesting that this system is susceptible to desensitization. Our findings support a putative causal role for fetally derived GDF15 in the nausea and vomiting of human pregnancy, with maternal sensitivity, at least partly determined by prepregnancy exposure to the hormone, being a major influence on its severity. They also suggest mechanism-based approaches to the treatment and prevention of HG."
"
How do women picture the partner of their dreams? And how does this vary between women based on their age? 

A team of researchers led by the University of Göttingen investigated the complex relationships between age and preferences for a partner in a large, international sample of single women. The study found that most preferences for a partner showed no variation between women of different ages. However, higher age was linked to a preference for confident and assertive partners, as well as acceptance of a larger age range, in particular a higher acceptance of a partner being younger than oneself. Age was also linked to the parenting intentions of the ideal partner: consistently high in importance until approximately age 28 and then decreasing thereafter. The results were published in the Journal Human Nature.
To answer the question whether love knows no age, researchers from the University of Göttingen, Indiana University, and Queen's University Belfast, collaborated with the female health app CLUE to reach over 20,000 single women aged 18 to 67 years from nearly 150 countries via an online questionnaire. In addition to heterosexual women, this study also included two groups often neglected in psychological research: bisexual and lesbian women. Respondents were asked to rate how important attributes such as attractiveness, kindness and supportiveness, financial security and successfulness, as well as education and intelligence were to them in their partner. They were also asked to specify the youngest and oldest ages they would be happy to accept in a romantic partner. Using rigorous methods, the role of age in partner preferences was thoroughly investigated in these three groups.
Most partner preferences -- including the preference for a kind and supportive partner -- were consistently important, regardless of age. The study, however, revealed links between age and some specific preferences. ""What was particularly interesting for us is that for heterosexual women up to the age of 28, the importance of the ideal partner wanting to be or become a father remained equally high, but decreased thereafter,"" explains Laura Botzet from Göttingen University's Department of Biological Personality Psychology. Both evolutionary theories and psychological research on the ""biological clock"" would have suggested a later decline, namely between the ages of 40 and 50, when women approach the end of their reproductive phase. This unexpected earlier decrease could be linked to changing life plans, with younger women re-evaluating family goals, whilst older women, who already have children, prioritize different aspects of their relationship. The pattern varied by sexual orientation, potentially indicating different attitudes towards own children among the groups.
Botzet concludes: ""Love, it turns out, is not entirely ageless; it's nuanced. A woman's age is related to certain aspects of her desired partner, such as the preference for partners with stronger parenting intentions or the ideal age of a partner. These insights are exciting because they challenge conventional notions of how age is linked to the way women picture the partner of their dreams.""

","score: 14.65378648233487, grade_level: '15'","score: 15.496358486943166, grade_levels: ['college_graduate'], ages: [24, 100]",10.1007/s12110-023-09460-4,"Women’s capacity to reproduce varies over the life span, and developmental goals such as family formation are age-graded and shaped by social norms about the appropriate age for completing specific developmental tasks. Thus, a woman’s age may be linked to her ideas about what an ideal partner should be like. With the goals of replicating and extending prior research, in this study we examined the role of age in women’s partner preferences across the globe. We investigated associations of age with ideal long-term partner preferences in a cross-cultural sample of 17,254 single (i.e., unpartnered) heterosexual women, ages 18 to 67, from 147 countries. Data were collected via an online questionnaire, the Ideal Partner Survey. Confirming our preregistered hypotheses, we found no or only negligible age effects on preferences for kindness-supportiveness, attractiveness, financial security-successfulness, or education-intelligence. Age was, however, positively associated with preferences for confidence-assertiveness. Consistent with family formation goals, age was associated with an ideal partner’s parenting intentions (high until approximately age 30, then decreasing afterward). Age range deemed acceptable (and in particular, the discrepancy between one’s own age and the minimum ideal age of a partner) increased with age. This latter pattern also replicated in exploratory analyses based on subsamples of lesbian and bisexual women. In summary, age has a limited impact on partner preferences. Of the attributes investigated, only preference for confidence-assertiveness was linked with age. However, age range deemed acceptable and an ideal partner’s parenting intention, a dimension mostly neglected in earlier research, substantially vary with age."
