pls,fk_score,ari_score,reference,abstract
"
People with personality traits such as conscientiousness, extraversion and positive affect are less likely to be diagnosed with dementia than those with neuroticism and negative affect, according to a new analysis by researchers at the University of California, Davis and Northwestern University. The difference was not linked to physical damage to brain tissue found in dementia patients, but more likely to how certain personality traits help people navigate dementia-related impairments.

The work is published Nov. 29 in Alzheimer's & Dementia: The Journal of the Alzheimer's Association.
Previous studies have tried to establish links between personality traits and dementia, but these were mostly small and represented only specific populations, said Emorie Beck, assistant professor of psychology at UC Davis and first author on the paper.
""We wanted to leverage new technology to synthesize these studies and test the strength and consistency of these associations,"" Beck said. If those links hold up, then targeting personality traits for change in interventions earlier in life could be a way to reduce dementia risk in the long term, she said.
Beck and colleagues analyzed data from eight published studies including over 44,000 people, of whom 1,703 developed dementia. They looked at measures of the ""big five"" personality traits (conscientiousness, extraversion, openness to experience, neuroticism and agreeableness) and subjective wellbeing (positive and negative affect, and life satisfaction) compared to clinical symptoms of dementia (performance on cognitive tests) and brain pathology at autopsy.
Personality is typically thought to be linked to dementia risk through behavior, Beck said. For example, people who score high on conscientiousness may be more likely to eat well and take care of their health, which results in better health in the long term.
The researchers found that high scores on negative traits (neuroticism, negative affect) and low scores on positive traits (conscientiousness, extraversion, positive affect) were associated with a higher risk of a dementia diagnosis. High scores on openness to experience, agreeableness, and life satisfaction had a protective effect in a smaller subset of studies.

Link to diagnosis but not pathology
To their surprise, however, no link was found between these personality traits and actual neuropathology in the brains of people after death.
""This was the most surprising finding to us,"" Beck said. ""If personality is predictive of performance on cognitive tests but not pathology, what might be happening?""
One explanation is that some personality traits could make people more resilient to the damage caused by diseases such as Alzheimer's. People with higher levels of some traits may find ways, whether they are aware of it or not, to cope with and work around impairments. Other work by members of the study team has shown that some people with quite extensive pathology can show little impairment on cognitive tests.
The researchers also looked at other factors that could moderate the relationship between personality and dementia risk and neuropathology, including age, gender and educational attainment.
""We found almost no evidence for effects, except that conscientiousness's protective effect increased with age,"" Beck said.
Many factors contribute to the development of dementia. Among those that aren't directly related to genetics, this study is a first step in teasing out the associations between personality and dementia, Beck said. The researchers plan to continue and expand the work, including looking at people who show little impairment in the face of a lot of pathology. They also hope to look at other everyday factors that might play a role in developing dementia.
Part of the work was conducted while Beck was a postdoctoral researcher at Northwestern University in Chicago. Coauthors are: Tomiko Yoneda, UC Davis and Northwestern; Daniel Mroczek and Eileen Graham, Northwestern; Bryan James, David Bennett and John Morris, Rush University Medical Center, Chicago; Jason Hassenstab, Washington University School of Medicine, St. Louis; Mindy Katz and Richard Lipton, Albert Einstein College of Medicine, the Bronx.
The work was supported by grants from the National Institute on Aging.

","score: 15.046575057606926, grade_level: '15'","score: 16.160532231776543, grade_levels: ['college_graduate'], ages: [24, 100]",10.1002/alz.13523,"The extent to which the Big Five personality traits and subjective well‐being (SWB) are discriminatory predictors of clinical manifestation of dementia versus dementia‐related neuropathology is unclear. Using data from eight independent studies (Ntotal= 44,531; Ndementia= 1703; baseline Mage= 49 to 81 years, 26 to 61% female; Mfollow‐up range = 3.53 to 21.00 years), Bayesian multilevel models tested whether personality traits and SWB differentially predicted neuropsychological and neuropathological characteristics of dementia. Synthesized and individual study results indicate that high neuroticism and negative affect and low conscientiousness, extraversion, and positive affect were associated with increased risk of long‐term dementia diagnosis. There were no consistent associations with neuropathology. This multistudy project provides robust, conceptually replicated and extended evidence that psychosocial factors are strong predictors of dementia diagnosis but not consistently associated with neuropathology at autopsy. N(+), C(−), E(−), PA(−), and NA(+) were associated with incident diagnosis. Results were consistent despite self‐report versus clinical diagnosis of dementia. Psychological factors were not associated with neuropathology at autopsy. Individuals with higher conscientiousness and no diagnosis had less neuropathology. High C individuals may withstand neuropathology for longer before death. N(+), C(−), E(−), PA(−), and NA(+) were associated with incident diagnosis. Results were consistent despite self‐report versus clinical diagnosis of dementia. Psychological factors were not associated with neuropathology at autopsy. Individuals with higher conscientiousness and no diagnosis had less neuropathology. High C individuals may withstand neuropathology for longer before death."
"
Many people are keen on making healthy as well as sustainable food choices, and they often intuitively equate ""healthy"" with being ""sustainable."" A study by researchers at the University of Konstanz, the Johannes Kepler University Linz and the Hamburg University of Applied Sciences is focusing on whether or not this perception corresponds to reality. It has just been published in the scientific journal PLOS Sustainability and Transformation.

The study shows that many consumers clearly correlate their perception of sustainability with how healthy their food choices and meals are. ""We examined just how widespread the perception is that healthy meals are also sustainable. We were especially interested in whether perceptions change based on the actual overlap between meal health and sustainability. We also explored whether the type of meal, such as a vegan meal, influences this presumed correlation,"" explains Professor Gudrun Sproesser, head of the Department of Health Psychology at Johannes Kepler University.
In the study, over 5,000 customers rated 29 different meal options at a public canteen -- i.e. the University of Konstanz's canteen, run by Seezeit student services -- as to what they believed to be a healthy and sustainable food choice. The exact values relating to environmental sustainability and healthy eating were also determined by applying a special algorithm to analyze the precise meal recipes. The findings were clear: Many participants automatically believed that healthy food was also sustainable.
Gudrun Sproesser points out: ""Interestingly, however, there was no association between this perception and the actual overlap between environmental sustainability and how healthy a meal actually is."" This is because healthier foods can be produced using methods that are less eco-friendly, and the reverse is also true: sustainable food can be less healthy.
Britta Renner, who leads the research team Psychological Assessment and Health Psychology at the University of Konstanz, adds: ""The findings clearly indicate that we consumers need better and more readily accessible information about the sustainability and healthiness of foods."" One useful approach, for example, is to use climate or sustainability labels on food, as suggested in a recent expert opinion on more sustainable food by the Scientific Advisory Board on Agricultural Policy, Food and Consumer Health Protection (WBAE) of the Federal Ministry of Food and Agriculture. Such labels would enable consumers to make more informed decisions about what they eat while simultaneously doing their part to protect the environment.

","score: 15.972425373134328, grade_level: '16'","score: 16.75630597014925, grade_levels: ['college_graduate'], ages: [24, 100]",10.1371/journal.pstr.0000086,"Research has found an association between the perceived sustainability and healthiness of foods and meals between individual consumers. The current study aimed to investigate whether the association between perceived sustainability and healthiness on the individual level is rooted in reality. Moreover, we investigated whether meal or individual characteristics affect this association. In total, 5021 customers of a public canteen rated the sustainability and healthiness of 29 meal options. For determining the actual environmental sustainability and healthiness scores, exact recipes of each meal were analyzed using the NAHGAST algorithm. Results showed a substantial association between perceived sustainability and healthiness at the individual level. However, this perceived relation was unrelated to the overlap between the actual environmental sustainability and healthiness scores of the meals. Moreover, this “healthier = more sustainable” perception was unrelated to other meal characteristics (e.g., vegan content) or individual characteristics (i.e., gender, eating style). However, this association was slightly higher in older than in younger participants. The present study shows in a real-world setting that food consumers seem to evaluate the sustainability and healthiness of meals based on a simple “healthy = sustainable” heuristic which is largely independent of the actual overlap of these dimensions. Future research is needed to shed more light on the nature, sources, and consequences of this heuristic."
"
Streptococcus agalactiae (known as Group B Streptococcus, or GBS) is present in the genital tract in around one in five women. Previous research by the team at the University of Cambridge and Rosie Hospital, Cambridge University Hospitals NHS Foundation Trust, identified GBS in the placenta of around 5% of women prior to the onset of labour. Although it can be treated with antibiotics, unless screened, women will not know they are carriers.

GBS can cause sepsis, a life-threatening reaction to an infection, in the newborn. Worldwide, GBS accounts for around 50,000 stillbirths and as many as 100,000 infant deaths per year.
In a study published today in Nature Microbiology, the team looked at the link between the presence of GBS in the placenta and the risk of admission of the baby to a neonatal unit. The researchers re-analysed data available from their previous study of 436 infants born at term, confirming their findings in a second cohort of 925 pregnancies.
From their analysis, the researchers estimate that placental GBS was associated with a two- to three-fold increased risk of neonatal unit admission, with one in 200 babies admitted with sepsis associated with GBS -- almost 10 times the previous estimate. The clinical assessment of these babies using the current diagnostic testing identified GBS in less than one in five of these cases.
In the USA, all pregnant women are routinely screened for GBS and treated with antibiotics if found to be positive. In the UK, women who test positive for GBS are also treated with antibiotics -- however, only a minority of pregnant women are tested for GBS, as the approach in the UK is to obtain samples only from women experiencing complications, or with other risk factors.
There are a number of reasons why women in the UK are not screened, including the fact that detecting GBS in the mother is not always straightforward and only a small minority of babies exposed to the bacteria were thought to become ill. A randomised controlled trial of screening for GBS for treatment with antibiotics is currently underway in the UK.
Dr Francesca Gaccioli from the Department of Obstetrics & Gynaecology at the University of Cambridge said: ""In the UK, we've traditionally not screened mothers for GBS, but our findings -- that significantly more newborns are admitted to the neonatal unit as a result of GBS-related sepsis than was previously thought -- profoundly changes the risk/benefit balance of universal screening.""
To improve detection, the researchers have developed an ultrasensitive PCR test, which amplifies tiny amounts of DNA or RNA from a suspected sample to check for the presence of GBS. They have filed a patent with Cambridge Enterprise, the University of Cambridge's technology transfer arm, for this test.

Professor Gordon Smith, Head of Obstetrics & Gynaecology at the University of Cambridge, said: ""Using this new test, we now realise that the clinically detected cases of GBS may represent the tip of the iceberg of complications arising from this infection. We hope that the ultra-sensitive test developed by our team might lead to viable point-of-care testing to inform immediate neonatal care.""
When the researchers analysed serum from the babies' umbilical cords, they found that over a third showed greatly increased levels of several cytokines -- protein messengers release by the immune system. This suggests that a so-called 'cytokine storm' -- an extreme immune response that causes collateral damage to the host -- was behind the increased risk of disease.
The research was funded by the Medical Research Council and supported by the National Institute for Health Research (NIHR) Cambridge Biomedical Research Centre.

","score: 15.90390756302521, grade_level: '16'","score: 17.47787394957983, grade_levels: ['college_graduate'], ages: [24, 100]",10.1038/s41564-023-01528-2,"Streptococcus agalactiae (Group B Streptococcus; GBS) is a common cause of sepsis in neonates. Previous work detected GBS DNA in the placenta in ~5% of women before the onset of labour, but the clinical significance of this finding is unknown. Here we re-analysed this dataset as a case control study of neonatal unit (NNU) admission. Of 436 infants born at term (≥37 weeks of gestation), 7/30 with placental GBS and 34/406 without placental GBS were admitted to the NNU (odds ratio (OR) 3.3, 95% confidence interval (CI) 1.3–7.8). We then performed a validation study using non-overlapping subjects from the same cohort. This included a further 239 cases of term NNU admission and 686 term controls: 16/36 with placental GBS and 223/889 without GBS were admitted to the NNU (OR 2.4, 95% CI 1.2–4.6). Of the 36 infants with placental GBS, 10 were admitted to the NNU with evidence of probable but culture-negative sepsis (OR 4.8, 95% CI 2.2–10.3), 2 were admitted with proven GBS sepsis (OR 66.6, 95% CI 7.3–963.7), 6 were admitted and had chorioamnionitis (inflammation of the foetal membranes) (OR 5.3, 95% CI 2.0–13.4), and 5 were admitted and had funisitis (inflammation of the umbilical cord) (OR 6.7, 95% CI 12.5–17.7). Foetal cytokine storm (two or more pro-inflammatory cytokines >10 times median control levels in umbilical cord blood) was present in 36% of infants with placental GBS DNA and 4% of cases where the placenta was negative (OR 14.2, 95% CI 3.6–60.8). Overall, ~1 in 200 term births had GBS detected in the placenta, which was associated with infant NNU admission and morbidity."
"
While past research has indicated that moderate alcohol consumption can lower one's risk of cardiovascular disease (CVD), more recent studiessuggest that moderate levels of drinking may be hazardous to heart health. A new analysis led by Boston University School of Public Health and Friedman School of Nutrition Science and Policy at Tufts University (Friedman School) now sheds new insight on this complex relationship between alcohol consumption and the progression of CVD.

Published in the journal BMC Medicine, the study found that alcohol consumption may have counteractive effects on CVD risk, depending on the biological presence of certain circulating metabolites -- molecules that are produced during or after a substance is metabolized and studied as biomarkers of many diseases.
The researchers observed a total of 60 alcohol consumption-related metabolites, identifying seven circulating metabolites that link long-term moderate alcohol consumption with an increased risk of CVD, and three circulating metabolites that link this same drinking pattern with a lower risk of CVD.
The findings provide a better understanding of the molecular pathway of long-term alcohol consumption and highlight the need for and direction of further research on these metabolites to inform targeted prevention and treatment of alcohol-related CVD.
""The study findings demonstrate that alcohol consumption may trigger changes of our metabolomic profiles, potentially yielding both beneficial and harmful outcomes,"" says Dr.Chunyu Liu, assistant professor of biostatistics at BUSPH and co-corresponding/co-senior author of the study along with Dr.Jiantao Ma, assistant professor in the Division of Nutrition Epidemiology and Data Science at the Friedman School. ""Because the majority of our study participants are moderate alcohol consumers, our findings contribute to the ongoing discussion about the relationship between moderate alcohol drinking and heart health.
""However, rather than definitively settling that debate, this study underscores the intricate effects of alcohol consumption on cardiovascular health and generates a useful hypothesis for future investigations,"" Dr. Liu says.
For the study, the researchers examined blood samples to measure the association between the cumulative average consumption of beer, wine, and liquor and 211 metabolites among 2,428Framingham Heart Study Offspring Study participants, who are the children of participants in the long-running Boston University-basedFramingham Heart Study, over 20 years. Among the participants, 636 developed CVD over the study period.

Among the 60 drinking-related metabolites, 13 metabolites had a stronger association with alcohol consumption in women than in men, perhaps due to women's generally smaller body size and likely higher blood alcohol concentration after consuming the same amount of alcohol as men.
The results also showed that consumption of different types of alcohol was linked to different metabolomic responses, with beer consumption generating a slightly weaker association overall than wine and liquor. In roughly two-thirds of the 60 metabolites, higher plasma levels were detected in participants who consumed greater amounts of alcohol.
Branched-chain amino acids (BCAAs), were among the metabolites that were not associated with alcohol consumption.
The researchers then calculated two alcohol consumption-associated metabolite scores, which had opposite associations with the development of CVD.
""While our study presents intriguing findings, validation through state-of-the-art methods and large and diverse study populations is crucial,"" Dr. Ma says. ""To enhance reliability, we aim to conduct larger-scale research involving a more diverse racial and ethnic background, as the current study participants are all white. In addition, we will expand our study to integrate with other molecular markers such as genetic information to illustrate the complex relationships between alcohol consumption, metabolite features, and cardiovascular risk.""
The study was funded by the National Institute on Alcohol Abuse and Alcoholism. Data collection in the Framingham Heart Study was supported by the National Heart, Lung, and Blood Institute.

","score: 19.251473684210527, grade_level: '19'","score: 21.418009868421052, grade_levels: ['college_graduate'], ages: [24, 100]",10.1186/s12916-023-03149-2,"Metabolite signatures of long-term alcohol consumption are lacking. To better understand the molecular basis linking alcohol drinking and cardiovascular disease (CVD), we investigated circulating metabolites associated with long-term alcohol consumption and examined whether these metabolites were associated with incident CVD. Cumulative average alcohol consumption (g/day) was derived from the total consumption of beer, wine, and liquor on average of 19 years in 2428 Framingham Heart Study Offspring participants (mean age 56 years, 52% women). We used linear mixed models to investigate the associations of alcohol consumption with 211 log-transformed plasma metabolites, adjusting for age, sex, batch, smoking, diet, physical activity, BMI, and familial relationship. Cox models were used to test the association of alcohol-related metabolite scores with fatal and nonfatal incident CVD (myocardial infarction, coronary heart disease, stroke, and heart failure). We identified 60 metabolites associated with cumulative average alcohol consumption (p < 0.05/211 ≈ 0.00024). For example, 1 g/day increase of alcohol consumption was associated with higher levels of cholesteryl esters (e.g., CE 16:1, beta = 0.023 ± 0.002, p = 6.3e − 45) and phosphatidylcholine (e.g., PC 32:1, beta = 0.021 ± 0.002, p = 3.1e − 38). Survival analysis identified that 10 alcohol-associated metabolites were also associated with a differential CVD risk after adjusting for age, sex, and batch. Further, we built two alcohol consumption weighted metabolite scores using these 10 metabolites and showed that, with adjustment age, sex, batch, and common CVD risk factors, the two scores had comparable but opposite associations with incident CVD, hazard ratio 1.11 (95% CI = [1.02, 1.21], p = 0.02) vs 0.88 (95% CI = [0.78, 0.98], p = 0.02). We identified 60 long-term alcohol consumption-associated metabolites. The association analysis with incident CVD suggests a complex metabolic basis between alcohol consumption and CVD."
