pls,fk_score,ari_score,reference,abstract
"
We've all heard it: Put a frog in boiling water, and it will jump out. But put the same frog in lukewarm water and heat it gradually, and you'll cook the frog. Often used as a metaphor for the unhurried and stubborn response many have to a slowly rising threat, the mechanisms underlying the urban myth have become a subject of scientific fascination.

This parable seems to have inspired new Northwestern University research, which identified a brain pathway responsible for rapid-threat detection.
""Animals are more likely to react to rapid rather than slow environmental change,"" said lead author Marco Gallio, associate professor of neurobiology in Northwestern's Weinberg College of Arts and Sciences. ""In the present study, we identify a brain circuit in fruit flies that selectively responds to rapid thermal change, priming behavior for escape.""
The findings were published last week in the journal Nature Communications.
Gallio generally uses fruit flies to understand sensory circuits and the ways they create perceptions of the physical world. Using the fly as a model, the lab studies basic decision-making principles in an animal that has a fraction of the number of neurons (100,000) than humans have (roughly 100 billion). As a well-studied model organism for biological research, flies also are useful subjects because of the pre-existing tools to study fly neurons and behavior.
""There are often two types of responses to external stimuli in the brain: Some neurons respond to a stimulus like light or temperature with very persistent activity,"" Gallio said. ""Other neurons fire just at the beginning, like when a light turns on, and then their activity is gone. We've always wondered what the significance of these short-lived responses is.""
In visual stimuli, brains are wired to notice a large contrast between light and dark. Gallio said that the response intuitively also makes sense for the sense of touch: You don't think about pressure when your hand is resting on a surface. Run your hand over something new, however, and you will detect subtle changes in texture. Gallio's team wanted to see if the same was true for the sense of temperature.

To explore how flies respond to rapid change, the team used a high-resolution camera to observe flies navigating different temperature environments. When flies encounter a rapid heat front, they always produce a U-turn away from it.
The lab found flies always responded in cases of rapid temperature change, but not for slow change.
The team also identified a circuit in the fly brain that responds only to rapid temperature change (more than 0.2 degrees Celsius per second). Much like light-ON cells of the visual system, these neurons fired at the beginning of rapid heating and then went quiet.
""Our hypothesis was that these heat-ON responses may indeed correlate with the rate of temperature change,"" said Jenna Jouandet, the study's first author and a Ph.D. student in the Gallio Lab. ""And therefore, may allow flies to anticipate dangerous thermal conditions and prepare to escape.""
Indeed, when the researchers experimentally inactivated those neurons, flies escaped less promptly.
To better understand how the activity of these neurons may be important for the behavior of the fly, the researchers collaborated with William Kath, applied math professor at Northwestern and deputy director of the new National Institute for Theory and Mathematics in Biology. Applied math Ph.D. student Richard Suhendra built a small computer model with two antennae and two wheels to demonstrate how adding a neuron that anticipates dangerous heat could improve the flexibility of the vehicle response. (Play with the model through a simple game on the Gallio Lab webpage.)
""The neurons that we initially discovered take input from the thermosensory neurons on the antennae and carry information to the higher brain,"" Gallio said. ""Flies are a great model to map brain circuits in that we were able to reconstruct the full circuit from sensory neurons all the way down to the centers that produce movement.""

Gallio explained that rapid changes are nearly always dangerous for a small fly.
""If the temperature is changing by half a degree per second -- which is not that much -- within 30 or 40 seconds, that fly could be dead,"" Gallio said. ""This system is an alarm bell that rings to prime an animal's behavior for escape. We see the fly escape.""
Gallio hypothesizes that the results are broadly generalizable, especially because he sees it play out in humans, whether someone is entering a room that's a different temperature or getting into a hot shower. He said these neurons seem to be able to sense something others do not -- they seem to be able to anticipate the future.
The research reported in this publication was supported by the National Institutes of Health (grants R01NS086859, R21EY031849 and R21NS130554), a Pew Scholars Program in the Biomedical Sciences and a McKnight Technological Innovations in Neuroscience Awards. The research was supported in part through the computational resources provided for the Quest high performance computing facility at Northwestern University, which is jointly supported by the Office of the Provost, the Office for Research and Northwestern University Information Technology; the Training Grant in Circadian and Sleep Research (T32HL007909) and the National Science Foundation research training grant (DMS-1547394).

","score: 12.634785553047404, grade_level: '13'","score: 13.942691576571228, grade_levels: ['college_graduate'], ages: [24, 100]",10.1038/s41467-023-42864-5,"Neurons that participate in sensory processing often display “ON” responses, i.e., fire transiently at the onset of a stimulus. ON transients are widespread, perhaps universal to sensory coding, yet their function is not always well-understood. Here, we show that ON responses in the Drosophila thermosensory system extrapolate the trajectory of temperature change, priming escape behavior if unsafe thermal conditions are imminent. First, we show that second-order thermosensory projection neurons (TPN-IIIs) and their Lateral Horn targets (TLHONs), display ON responses to thermal stimuli, independent of direction of change (heating or cooling) and of absolute temperature. Instead, they track the rate of temperature change, with TLHONs firing exclusively to rapid changes (>0.2 °C/s). Next, we use connectomics to track TLHONs’ output to descending neurons that control walking and escape, and modeling and genetic silencing to demonstrate how ON transients can flexibly amplify aversive responses to small thermal change. Our results suggest that, across sensory systems, ON transients may represent a general mechanism to systematically anticipate and respond to salient or dangerous conditions."
"
Quiz shows, where contestants answer rapid-fire questions in a high-stress, high-stakes environment, are an integral part of TV programming -- and now they are demonstrating that they have research value.

By analyzing contestants' behavior and patterns of blinking on the British TV show ""Mastermind,"" cognitive scientists at the University of Arizona have studied human physiology under conditions of stress that would be impossible to reproduce in the lab.
The results were published yesterday in the journal Psychophysiology.
""This is a dream I've had for a long time -- to try to get physiological information out of video signals,"" said Robert Wilson, senior author on the paper, who is an associate professor in cognition and neural systems at the UArizona Department of Psychology, in the College of Science.
On ""Mastermind,"" contestants sit in a big leather chair, Wilson said, answering rapid-fire questions under the glare of spotlights as a camera slowly zooms in on their face. The bright lights and slow camera work make it easy to identify blinks, and the stress of being interrogated on national TV cannot be re-created under lab conditions, he said.
""This is a feasible method for doing video-based neuroscience in outside-the-lab conditions so that we can get into situations that are closer to real-world scenarios,"" said Skyler Wyly, the lead author of the study, who began this work as an undergraduate at UArizona and is now a doctoral student at Duke University.
How blinking is related to cognitive effort still needs to be explored, especially in real world tasks, Wilson said. However, he mentioned that there is a hypothesis that the more stressed humans are, the more they blink.

""We are yet to know about all the cognitive processes that modulate blinking,"" Wilson said.
The researchers analyzed 25 episodes from two seasons of the game show to collect data from 100 contestants. A team of nearly 60 research assistants marked the onset and offset of every question and every response made by the contestants, as well as the time of every blink, all of which contributed to nearly 100,000 data points. The researchers then analyzed the data to determine how blinking varied across individuals at different points in the game and compared their findings to those from less-stressful experiments performed in previous lab-based studies.
One key finding from the lab is that blinking acts like a ""punctuation of thought,"" Wilson said, and this result held true on TV. Contestants blinked at the ""punctuation marks"" of the game -- at the start of each question and at the start of their response. They also reduced their blinking while they were thinking about how to answer, which is also in line with results from the lab, Wilson said. The stress of ""Mastermind"" was also apparent in contestants' blinking, with their blink rate nearly twice the number of the usual 20 blinks per minute of a person who is at rest.
However, some findings differed from lab tests. For example, in the TV show, older adults blinked more than younger adults, and women blinked more than men. In the lab, there are no differences between these groups, Wilson said.
There were also some behavioral differences. In lab tests, people tend to slow down and respond more carefully and accurately after they make an error. In ""Mastermind,"" this was not the case.
It's not clear what is driving these differences between the lab and TV, but according to Wilson, the differences are the most exciting part of the research. One of the biggest questions in psychology right now, Wilson said, is how much of what is observed in the lab relates to what is going on in the real world.
""This question is critical, not only for our basic understanding of the mind, but also more practically if we want to find lab tests that can diagnose mental illness,"" Wilson said.
For the researchers at UArizona, blinks are just the beginning, and there is so much information in video signals, Wilson said. The way people look, breathe and fidget in their seat can be pulled out by modern computer vision techniques. This can help researchers get a multidimensional measure of physiology.
""This is exactly what we need to study -- the psychophysiology of real human behavior and real human thinking,"" Wilson said.

","score: 12.265229366165073, grade_level: '12'","score: 13.253087095303236, grade_levels: ['college_graduate'], ages: [24, 100]",10.1111/psyp.14485,"Television game shows have proven to be a valuable resource for studying human behavior under conditions of high stress and high stakes. However, previous work has focused mostly on choices—ignoring much of the rich visual information that is available on screen. Here, we take a first step to extracting more of this information by investigating the response times and blinking of contestants in the BBC show Mastermind. In Mastermind, contestants answer rapid‐fire quiz questions while a camera slowly zooms in on their faces. By labeling contestants' behavior and blinks from 25 episodes, we asked how accuracy, response times, and blinking varied over the course of the game. For accuracy and response times, we tested whether contestants responded more accurately and more slowly after an error—exhibiting the “post‐error increase in accuracy” and “post‐error slowing” which has been repeatedly observed in the lab. For blinking, we tested whether blink rates varied according to the cognitive demands of the game—decreasing during periods of cognitive load, such as when pondering a response, and increasing at event boundaries in the task, such as the start of a question. In contrast to the lab, evidence for post‐error changes in accuracy and response time was weak, with only marginal effects observed. In line with the lab, blinking varied over the course of the game much as we predicted. Overall, our findings demonstrate the potential of extracting dynamic signals from game shows to study the psychophysiology of behavior in the real world."
"
Many mammals, from domestic cats and dogs to giant pandas, use scent to communicate with each other. A new study from the University of California, Davis shows how domestic cats send signals to each other using odors derived from families of bacteria living in their anal glands. The work was published Nov. 8 in Scientific Reports.

The study adds to a growing body of research on the relationship between microbes and odor in mammals, including domestic dogs, wild animals such as foxes, pandas and hyenas, and humans.
Cats' scent comes from a mix of volatile organic compounds, including aldehydes, alcohols, esters and ketones. While mostly undetectable to human noses, these scents are important in cats' behavior and social lives. They mark territory, attract mates and repel rivals.
Connie Rojas, a postdoctoral researcher working with Professor Jonathan Eisen at the UC Davis Department of Evolution and Ecology and Genome Center, led a three-part study of anal gland secretions from domestic cats. They used DNA sequencing, mass spectrometry and microbial culturing to look at the chemicals in the secretions and the microbes that make them.
The subjects in the study were 23 domestic cats seen at the UC Davis Veterinary Medical Teaching Hospital for elective procedures such as dental cleaning. Owners gave written permission for their cats to take part in the study.
Highly variable microbiome
Five genera of bacteria (Corynebacterium, Bacteroides, Proteus, Lactobacillus and Streptococcus) dominated overall, but the microbial makeup was highly variable between individual cats. Older cats generally had a different microbiome from younger animals. There were also some apparent differences in cats assessed as obese, but the sample size was not large enough to confirm this. Microbial populations might also be affected by factors such as the cat's diet, health conditions and its overall living environment.

Looking at the chemicals produced in the anal glands, the researchers detected hundreds of organic compounds. Genetic analysis showed that the bacteria living in the anal gland could be responsible for making these compounds.
The researchers hope to continue and expand the study to include more domestic cats as well as other species of cats.
Additional coauthors on the study, all at UC Davis, are: David Coil, Genome Center; Stanley Marks, School of Veterinary Medicine; Eva Borras, Mitchell McCartney and Cristina Davis, Department of Mechanical and Aerospace Engineering and UC Davis Lung Center; and Hira Lesea, Department of Microbiology and Molecular Genetics.
The work was supported in part by grants from the National Institutes of Health and by a UC Davis Chancellor's fellowship to Rojas.

","score: 13.675841607565012, grade_level: '14'","score: 14.109113475177303, grade_levels: ['college_graduate'], ages: [24, 100]",10.1038/s41598-023-45997-1,"Many mammals rely on volatile organic chemical compounds (VOCs) produced by bacteria for their communication and behavior, though little is known about the exact molecular mechanisms or bacterial species that are responsible. We used metagenomic sequencing, mass-spectrometry based metabolomics, and culturing to profile the microbial and volatile chemical constituents of anal gland secretions in twenty-three domestic cats (Felis catus), in attempts to identify organisms potentially involved in host odor production. We found that the anal gland microbiome was dominated by bacteria in the genera Corynebacterium, Bacteroides, Proteus, Lactobacillus, and Streptococcus, and showed striking variation among individual cats. Microbiome profiles also varied with host age and obesity. Metabolites such as fatty-acids, ketones, aldehydes and alcohols were detected in glandular secretions. Overall, microbiome and metabolome profiles were modestly correlated (r = 0.17), indicating that a relationship exists between the bacteria in the gland and the metabolites produced in the gland. Functional analyses revealed the presence of genes predicted to code for enzymes involved in VOC metabolism such as dehydrogenases, reductases, and decarboxylases. From metagenomic data, we generated 85 high-quality metagenome assembled genomes (MAGs). Of importance were four MAGs classified as Corynebacterium frankenforstense, Proteus mirabilis, Lactobacillus johnsonii, and Bacteroides fragilis. They represent strong candidates for further investigation of the mechanisms of volatile synthesis and scent production in the mammalian anal gland."
"
After a long day at work, you open the door to the place you call home. A chorus of furry happiness rushes toward you, the sound of unconditional canine love. With your return, your dog's world is whole.

Virginia Tech and Arizona State University researchers are working to help more shelter dogs experience this kind of love, safety, and happiness in an adoptive home.
The research team in Virginia Tech's College of Agriculture and Life Sciences found that implementing shorter-term fostering programs at animal shelters vastly improves adoptions for our canine friends.
Spending time with a dog is one of the most consistently effective ways to improve a dog's life in the shelter. Time out of the kennel with a person can reduce physiological measures of stress, as can a single night or more in a foster caregiver's home.
In this study, the researchers assessed the effects of outings of just a few hours and fostering stays of one to two nights on dogs' length of stay in the shelter and their adoption outcomes.
The researchers found that brief outings and temporary fostering stays increased dogs' likelihood of adoption by five and more than 14 times, respectively. The team also found that these programs were more successful when a greater proportion of community members were providing outings and stays to the shelters' dogs as well as when these programs were carried out by shelters with more resources.
While short in their duration, these fostering programs can make a big impact on the lives of shelter dogs.

The research was funded with a $1.7 million grant from Maddie's Fund, a national family foundation established by Dave and Cheryl Duffield to revolutionize the status and well-being of companion animals, and was published today in the journal Animals.
Helping man's best friend
At Virginia Tech, the project was spearheaded by Erica Feuerbacher, associate professor in the School of Animal Sciences, and Lisa Gunter, assistant professor in the school who originally worked on the project as the Maddie's Fund Research Fellow at Arizona State University.
In previous work, the team investigated how outings and temporary fostering stays influenced dogs' stress and activity levels but did not consider if these experiences helped homeless canines find their forever homes. The answer, based on the research, is yes.
""It's a really exciting finding. Our prior work showed how beneficial sleepovers were for reducing dogs' stress,"" Feuerbacher said. ""It's wonderful to know that it also helps them get adopted.""
The results showed that for foster outings, about 4 percent of the people ended up adopting the dog. For overnight stays, the number increased to about 12 percent. Both results show that the vast majority of adopters were not the foster families.

""We saw that the majority of people adopting the dogs weren't the caregivers that were taking the dogs on outings or letting them stay in their homes. These dogs were being seen in the community, meeting new people, and caregivers were sharing their stories,"" Gunter said. ""This increased exposure likely helped the dogs find their adopters.""
Data was analyzed from 51 animal shelters in the United States on 1,955 dogs that received these fostering interventions as well as 25,946 dogs residing at these shelters that served as the study's controls. Over the grant's four-year lifespan, 85 shelter partners helped the research team carry out studies on brief outings, temporary stays, foster caregiving during the pandemic, weeklong fostering, and safety net fostering for pets whose owners were experiencing hardship.
While dogs' lengths of stay in this study were longer in comparison to dogs that did not receive a brief outing or temporary fostering, this difference was present prior to the intervention, suggesting that shelters are using these programs for dogs that need more help in finding homes. After going on an outing or fostering stay, dogs waited just 10 days to be adopted.
""Our data show that these programs can help the dogs not only have an improved experience in the shelter, but also dramatically increase their likelihood of adoption, and for the shelters that get their communities involved in brief outings and temporary fostering stays, better performing programs,"" Gunter said.
Clive Wynne, at Arizona State University, led the project, who was assisted by Gunter when she was a research scientist at the university.
""It's great news that even short-term fostering has positive impacts on shelter dogs' welfare and helps them get adopted because there are so many dogs in shelters in the United States and even the best shelters are not good places for dogs to be living,"" Wynne said.
Future paw prints
The increase in dog adoptions with short-term foster programs underscores their value to local shelters, the researchers said. Their findings highlight the importance of having resources available to shelters to support these programs. These programs are not as easy for some shelters as they are for others -- it takes support both financial and human.
""These kinds of fostering programs can save the lives of dogs in shelters,"" Gunter said. ""Currently, shelters are struggling with dog adoptions, and we have evidence that these programs support placement into homes, which in turn can help shelters help more dogs.""
Wynne also saw the future of this work as easy to implement for shelters.
""One of the beauties of this program of research is that the fostering intervention is relatively low cost for shelters,"" Wynne said. ""More than anything else, what shelters need is education on how to implement fostering, and helping them with that was an important aspect of this research program.""

","score: 12.472718762718767, grade_level: '12'","score: 14.03601953601953, grade_levels: ['college_graduate'], ages: [24, 100]",10.3390/ani13223528,"Human interaction is one of the most consistently effective interventions that can improve the welfare of shelter-living dogs. Time out of the kennel with a person has been shown to reduce physiological measures of stress as can leaving the shelter for a night or more in a foster home. In this study, we assessed the effects of brief outings and temporary fostering stays on dogs’ length of stay and outcomes. In total, we analyzed data of 1955 dogs from 51 animal shelters that received these interventions as well as 25,946 dogs residing at these shelters that served as our controls. We found that brief outings and temporary fostering stays increased dogs’ likelihood of adoption by 5.0 and 14.3 times, respectively. While their lengths of stay were longer in comparison to control dogs, this difference was present prior to the intervention. Additionally, we found that these programs were more successful when greater percentages of community members (as compared to volunteers and staff) were involved in caregiving as well as when programs were implemented by better-resourced shelters. As such, animal welfare organizations should consider implementing these fostering programs as evidence-based best practices that can positively impact the outcomes of shelter dogs."
